19:39:04.332734 IP 10.5.0.107.68 > 10.5.0.1.67: BOOTP/DHCP, Request from 00:0c:29:d3:39:8e, length 300
19:39:04.332771 IP 10.5.0.107.68 > 10.5.0.1.67: BOOTP/DHCP, Request from 00:0c:29:d3:39:8e, length 300
19:39:05.020986 IP 10.5.0.2.54915 > 10.5.0.255.54915: UDP, length 263
19:39:05.020986 IP 10.5.0.2.54915 > 10.5.0.255.54915: UDP, length 263
19:39:05.328089 IP6 fe80::383f:ff6f:7e9:f448.61940 > ff02::c.1900: UDP, length 146
19:39:05.328089 IP6 fe80::383f:ff6f:7e9:f448.61940 > ff02::c.1900: UDP, length 146
19:39:05.382507 IP 10.5.0.8.17500 > 255.255.255.255.17500: UDP, length 176
19:39:05.382507 IP 10.5.0.8.17500 > 255.255.255.255.17500: UDP, length 176
19:39:05.382566 IP 10.5.0.8.17500 > 10.5.0.255.17500: UDP, length 176
19:39:05.382566 IP 10.5.0.8.17500 > 10.5.0.255.17500: UDP, length 176
19:39:05.382926 IP 192.168.77.1.17500 > 192.168.77.255.17500: UDP, length 176
19:39:05.430377 IP6 fe80::383f:ff6f:7e9:f448 > ff02::1:ff76:6cf7: ICMP6, neighbor solicitation, who has fe80::5e96:9dff:fe76:6cf7, length 32
19:39:05.430377 IP6 fe80::383f:ff6f:7e9:f448 > ff02::1:ff76:6cf7: ICMP6, neighbor solicitation, who has fe80::5e96:9dff:fe76:6cf7, length 32
19:39:05.461617 STP 802.1d, Config, Flags [none], bridge-id 8000.a0:f3:c1:b7:c3:4e.8003, length 43
19:39:05.461617 STP 802.1d, Config, Flags [none], bridge-id 8000.a0:f3:c1:b7:c3:4e.8003, length 43
19:39:05.635163 IP 10.5.0.4.37946 > 255.255.255.255.1900: UDP, length 173
19:39:05.635163 IP 10.5.0.4.37946 > 255.255.255.255.1900: UDP, length 173
19:39:05.635670 IP 10.5.0.4.37946 > 255.255.255.255.1900: UDP, length 173
19:39:05.635670 IP 10.5.0.4.37946 > 255.255.255.255.1900: UDP, length 173
19:39:05.716666 IP 10.5.0.8.53195 > 192.168.166.209.24800: Flags [S], seq 1161285429, win 65535, options [mss 1460,nop,wscale 5,nop,nop,TS val 483094780 ecr 0,sackOK,eol], length 0
19:39:05.837906 IP 10.5.0.1.49735 > 255.255.255.255.7437: UDP, length 173
19:39:05.837906 IP 10.5.0.1.49735 > 255.255.255.255.7437: UDP, length 173
19:39:05.907013 IP 10.5.0.107.68 > 10.5.0.1.67: BOOTP/DHCP, Request from 00:0c:29:d3:39:8e, length 300
19:39:05.907075 IP 10.5.0.107.68 > 10.5.0.1.67: BOOTP/DHCP, Request from 00:0c:29:d3:39:8e, length 300
19:39:05.928230 IP 10.5.0.2.54915 > 10.5.0.255.54915: UDP, length 263
19:39:05.928230 IP 10.5.0.2.54915 > 10.5.0.255.54915: UDP, length 263
19:39:06.032036 IP6 fe80::383f:ff6f:7e9:f448 > ff02::1:ff76:6cf7: ICMP6, neighbor solicitation, who has fe80::5e96:9dff:fe76:6cf7, length 32
19:39:06.032036 IP6 fe80::383f:ff6f:7e9:f448 > ff02::1:ff76:6cf7: ICMP6, neighbor solicitation, who has fe80::5e96:9dff:fe76:6cf7, length 32
19:39:06.659301 IP 10.5.0.4.41309 > 10.5.0.255.32412: UDP, length 21
19:39:06.659301 IP 10.5.0.4.41309 > 10.5.0.255.32412: UDP, length 21
19:39:06.659362 IP 10.5.0.4.40868 > 10.5.0.255.32414: UDP, length 21
19:39:06.659362 IP 10.5.0.4.40868 > 10.5.0.255.32414: UDP, length 21
19:39:06.966621 IP 10.5.0.2.54915 > 10.5.0.255.54915: UDP, length 263
19:39:06.966621 IP 10.5.0.2.54915 > 10.5.0.255.54915: UDP, length 263
19:39:07.068890 IP6 fe80::383f:ff6f:7e9:f448 > ff02::1:ff76:6cf7: ICMP6, neighbor solicitation, who has fe80::5e96:9dff:fe76:6cf7, length 32
19:39:07.068890 IP6 fe80::383f:ff6f:7e9:f448 > ff02::1:ff76:6cf7: ICMP6, neighbor solicitation, who has fe80::5e96:9dff:fe76:6cf7, length 32
19:39:07.440328 IP 10.5.0.107.68 > 10.5.0.1.67: BOOTP/DHCP, Request from 00:0c:29:d3:39:8e, length 300
19:39:07.440384 IP 10.5.0.107.68 > 10.5.0.1.67: BOOTP/DHCP, Request from 00:0c:29:d3:39:8e, length 300
19:39:07.461675 STP 802.1d, Config, Flags [none], bridge-id 8000.a0:f3:c1:b7:c3:4e.8003, length 43
19:39:07.461675 STP 802.1d, Config, Flags [none], bridge-id 8000.a0:f3:c1:b7:c3:4e.8003, length 43
19:39:07.990601 IP 10.5.0.2.54915 > 10.5.0.255.54915: UDP, length 263
19:39:07.990601 IP 10.5.0.2.54915 > 10.5.0.255.54915: UDP, length 263
19:39:07.990948 IP 10.5.0.2.6771 > 239.192.152.143.6771: UDP, length 119
19:39:07.991189 IP6 fe80::383f:ff6f:7e9:f448 > ff02::1:ffff:fffe: ICMP6, neighbor solicitation, who has fe80::ffff:ffff:fffe, length 32
19:39:07.991189 IP6 fe80::383f:ff6f:7e9:f448 > ff02::1:ffff:fffe: ICMP6, neighbor solicitation, who has fe80::ffff:ffff:fffe, length 32
19:39:08.399977 IP6 fe80::383f:ff6f:7e9:f448.61940 > ff02::c.1900: UDP, length 146
19:39:08.399977 IP6 fe80::383f:ff6f:7e9:f448.61940 > ff02::c.1900: UDP, length 146
19:39:08.604851 IP6 fe80::383f:ff6f:7e9:f448 > ff02::1:ffff:fffe: ICMP6, neighbor solicitation, who has fe80::ffff:ffff:fffe, length 32
19:39:08.604851 IP6 fe80::383f:ff6f:7e9:f448 > ff02::1:ffff:fffe: ICMP6, neighbor solicitation, who has fe80::ffff:ffff:fffe, length 32
19:39:08.912071 IP 10.5.0.1.49735 > 255.255.255.255.7437: UDP, length 173
19:39:08.912071 IP 10.5.0.1.49735 > 255.255.255.255.7437: UDP, length 173
19:39:09.014646 IP 10.5.0.2.54915 > 10.5.0.255.54915: UDP, length 263
19:39:09.014646 IP 10.5.0.2.54915 > 10.5.0.255.54915: UDP, length 263
19:39:09.451702 IP 10.5.0.107.68 > 10.5.0.1.67: BOOTP/DHCP, Request from 00:0c:29:d3:39:8e, length 300
19:39:09.451736 IP 10.5.0.107.68 > 10.5.0.1.67: BOOTP/DHCP, Request from 00:0c:29:d3:39:8e, length 300
19:39:09.461682 STP 802.1d, Config, Flags [none], bridge-id 8000.a0:f3:c1:b7:c3:4e.8003, length 43
19:39:09.461682 STP 802.1d, Config, Flags [none], bridge-id 8000.a0:f3:c1:b7:c3:4e.8003, length 43
19:39:09.532332 IP6 fe80::383f:ff6f:7e9:f448 > ff02::1:ffff:fffe: ICMP6, neighbor solicitation, who has fe80::ffff:ffff:fffe, length 32
19:39:09.532332 IP6 fe80::383f:ff6f:7e9:f448 > ff02::1:ffff:fffe: ICMP6, neighbor solicitation, who has fe80::ffff:ffff:fffe, length 32
19:39:09.825523 IP 10.5.0.8.60398 > 17.172.232.12.5223: Flags [P.], seq 1686500510:1686500611, ack 3042859143, win 4096, options [nop,nop,TS val 483098887 ecr 3991147128], length 101
19:39:09.969954 IP 10.5.0.8.60398 > 17.172.232.12.5223: Flags [.], ack 54, win 4094, options [nop,nop,TS val 483099031 ecr 3992047161], length 0
19:39:09.985190 IP 10.5.0.2.54915 > 10.5.0.255.54915: UDP, length 263
19:39:09.985190 IP 10.5.0.2.54915 > 10.5.0.255.54915: UDP, length 263
19:39:10.245421 IP 10.5.0.107.68 > 10.5.0.1.67: BOOTP/DHCP, Request from 00:0c:29:d3:39:8e, length 300
19:39:10.245450 IP 10.5.0.107.68 > 10.5.0.1.67: BOOTP/DHCP, Request from 00:0c:29:d3:39:8e, length 300
19:39:10.468843 IP 10.5.0.8.53197 > 62.231.75.207.443: Flags [P.], seq 1964720260:1964721582, ack 1386743321, win 14086, options [nop,nop,TS val 483099529 ecr 2962403891], length 1322
19:39:10.482266 IP 10.5.0.8.53197 > 62.231.75.207.443: Flags [.], ack 2881, win 14041, options [nop,nop,TS val 483099541 ecr 2962413755], length 0
19:39:10.482297 IP 10.5.0.8.53197 > 62.231.75.207.443: Flags [.], ack 5761, win 13951, options [nop,nop,TS val 483099541 ecr 2962413755], length 0
19:39:10.482301 IP 10.5.0.8.53197 > 62.231.75.207.443: Flags [.], ack 5761, win 14086, options [nop,nop,TS val 483099541 ecr 2962413755], length 0
19:39:10.482303 IP 10.5.0.8.53197 > 62.231.75.207.443: Flags [.], ack 8641, win 13996, options [nop,nop,TS val 483099541 ecr 2962413755], length 0
19:39:10.482306 IP 10.5.0.8.53197 > 62.231.75.207.443: Flags [.], ack 10081, win 14086, options [nop,nop,TS val 483099541 ecr 2962413755], length 0
19:39:10.482674 IP 10.5.0.8.53197 > 62.231.75.207.443: Flags [.], ack 21601, win 13996, options [nop,nop,TS val 483099541 ecr 2962413755], length 0
19:39:10.483113 IP 10.5.0.8.53197 > 62.231.75.207.443: Flags [.], ack 33121, win 14041, options [nop,nop,TS val 483099541 ecr 2962413755], length 0
19:39:10.483547 IP 10.5.0.8.53197 > 62.231.75.207.443: Flags [.], ack 44641, win 13996, options [nop,nop,TS val 483099542 ecr 2962413755], length 0
19:39:10.488563 IP 10.5.0.8.53197 > 62.231.75.207.443: Flags [.], ack 56161, win 14041, options [nop,nop,TS val 483099547 ecr 2962413755], length 0
19:39:10.489027 IP 10.5.0.8.53197 > 62.231.75.207.443: Flags [.], ack 67681, win 13996, options [nop,nop,TS val 483099547 ecr 2962413756], length 0
19:39:10.489308 IP 10.5.0.8.53197 > 62.231.75.207.443: Flags [.], ack 79201, win 13906, options [nop,nop,TS val 483099548 ecr 2962413756], length 0
19:39:10.490164 IP 10.5.0.8.53197 > 62.231.75.207.443: Flags [.], ack 90721, win 13996, options [nop,nop,TS val 483099548 ecr 2962413757], length 0
19:39:10.490769 IP 10.5.0.8.53197 > 62.231.75.207.443: Flags [.], ack 102241, win 14041, options [nop,nop,TS val 483099549 ecr 2962413758], length 0
19:39:10.491831 IP 10.5.0.8.53197 > 62.231.75.207.443: Flags [.], ack 113761, win 13861, options [nop,nop,TS val 483099550 ecr 2962413758], length 0
19:39:10.492528 IP 10.5.0.8.53197 > 62.231.75.207.443: Flags [.], ack 125281, win 14041, options [nop,nop,TS val 483099550 ecr 2962413759], length 0
19:39:10.493301 IP 10.5.0.8.53197 > 62.231.75.207.443: Flags [.], ack 136801, win 14041, options [nop,nop,TS val 483099551 ecr 2962413760], length 0
19:39:10.493800 IP 10.5.0.8.53197 > 62.231.75.207.443: Flags [.], ack 148321, win 13996, options [nop,nop,TS val 483099551 ecr 2962413760], length 0
19:39:10.494760 IP 10.5.0.8.53197 > 62.231.75.207.443: Flags [.], ack 159841, win 13951, options [nop,nop,TS val 483099552 ecr 2962413760], length 0
19:39:10.495318 IP 10.5.0.8.53197 > 62.231.75.207.443: Flags [.], ack 171361, win 14041, options [nop,nop,TS val 483099553 ecr 2962413761], length 0
19:39:10.496524 IP 10.5.0.8.53197 > 62.231.75.207.443: Flags [.], ack 182881, win 13996, options [nop,nop,TS val 483099554 ecr 2962413762], length 0
19:39:10.496967 IP 10.5.0.8.53197 > 62.231.75.207.443: Flags [.], ack 194401, win 13996, options [nop,nop,TS val 483099554 ecr 2962413762], length 0
19:39:10.498210 IP 10.5.0.8.53197 > 62.231.75.207.443: Flags [.], ack 205921, win 14041, options [nop,nop,TS val 483099555 ecr 2962413764], length 0
19:39:10.498615 IP 10.5.0.8.53197 > 62.231.75.207.443: Flags [.], ack 217441, win 13951, options [nop,nop,TS val 483099555 ecr 2962413764], length 0
19:39:10.499194 IP 10.5.0.8.53197 > 62.231.75.207.443: Flags [.], ack 228961, win 13996, options [nop,nop,TS val 483099555 ecr 2962413766], length 0
19:39:10.499892 IP 10.5.0.8.53197 > 62.231.75.207.443: Flags [.], ack 230552, win 14036, options [nop,nop,TS val 483099556 ecr 2962413766], length 0
19:39:10.508354 IP 10.5.0.8.53197 > 62.231.75.207.443: Flags [.], ack 242072, win 14184, options [nop,nop,TS val 483099564 ecr 2962413788], length 0
19:39:10.509674 IP 10.5.0.8.53197 > 62.231.75.207.443: Flags [.], ack 253592, win 14049, options [nop,nop,TS val 483099565 ecr 2962413788], length 0
19:39:10.510012 IP 10.5.0.8.53197 > 62.231.75.207.443: Flags [.], ack 265112, win 14139, options [nop,nop,TS val 483099565 ecr 2962413788], length 0
19:39:10.511250 IP 10.5.0.8.53197 > 62.231.75.207.443: Flags [.], ack 276632, win 14184, options [nop,nop,TS val 483099566 ecr 2962413788], length 0
19:39:10.511851 IP 10.5.0.8.53197 > 62.231.75.207.443: Flags [.], ack 288152, win 14139, options [nop,nop,TS val 483099566 ecr 2962413788], length 0
19:39:10.512960 IP 10.5.0.8.53197 > 62.231.75.207.443: Flags [.], ack 299672, win 14004, options [nop,nop,TS val 483099567 ecr 2962413789], length 0
19:39:10.514158 IP 10.5.0.8.53197 > 62.231.75.207.443: Flags [.], ack 311192, win 14184, options [nop,nop,TS val 483099568 ecr 2962413790], length 0
19:39:10.514696 IP 10.5.0.8.53197 > 62.231.75.207.443: Flags [.], ack 322712, win 14139, options [nop,nop,TS val 483099568 ecr 2962413790], length 0
19:39:10.515574 IP 10.5.0.8.53197 > 62.231.75.207.443: Flags [.], ack 334232, win 14184, options [nop,nop,TS val 483099569 ecr 2962413791], length 0
19:39:10.516843 IP 10.5.0.8.53197 > 62.231.75.207.443: Flags [.], ack 345752, win 14139, options [nop,nop,TS val 483099570 ecr 2962413792], length 0
19:39:10.517141 IP 10.5.0.8.53197 > 62.231.75.207.443: Flags [.], ack 357272, win 14184, options [nop,nop,TS val 483099570 ecr 2962413792], length 0
19:39:10.517970 IP 10.5.0.8.53197 > 62.231.75.207.443: Flags [.], ack 368792, win 14094, options [nop,nop,TS val 483099571 ecr 2962413793], length 0
19:39:10.518684 IP 10.5.0.8.53197 > 62.231.75.207.443: Flags [.], ack 380312, win 14184, options [nop,nop,TS val 483099571 ecr 2962413793], length 0
19:39:10.519792 IP 10.5.0.8.53197 > 62.231.75.207.443: Flags [.], ack 391832, win 14139, options [nop,nop,TS val 483099572 ecr 2962413793], length 0
19:39:10.520387 IP 10.5.0.8.53197 > 62.231.75.207.443: Flags [.], ack 403352, win 14139, options [nop,nop,TS val 483099573 ecr 2962413794], length 0
19:39:10.521208 IP 10.5.0.8.53197 > 62.231.75.207.443: Flags [.], ack 414872, win 14184, options [nop,nop,TS val 483099574 ecr 2962413795], length 0
19:39:10.521708 IP 10.5.0.8.53197 > 62.231.75.207.443: Flags [.], ack 426392, win 14184, options [nop,nop,TS val 483099574 ecr 2962413795], length 0
19:39:10.522291 IP 10.5.0.8.53197 > 62.231.75.207.443: Flags [.], ack 437912, win 14139, options [nop,nop,TS val 483099575 ecr 2962413797], length 0
19:39:10.523061 IP 10.5.0.8.53197 > 62.231.75.207.443: Flags [.], ack 449432, win 14139, options [nop,nop,TS val 483099575 ecr 2962413797], length 0
19:39:10.523653 IP 10.5.0.8.53197 > 62.231.75.207.443: Flags [.], ack 460952, win 14139, options [nop,nop,TS val 483099576 ecr 2962413797], length 0
19:39:10.524495 IP 10.5.0.8.53197 > 62.231.75.207.443: Flags [.], ack 472472, win 14184, options [nop,nop,TS val 483099577 ecr 2962413797], length 0
19:39:10.525148 IP 10.5.0.8.53197 > 62.231.75.207.443: Flags [.], ack 483992, win 14184, options [nop,nop,TS val 483099577 ecr 2962413797], length 0
19:39:10.526113 IP 10.5.0.8.53197 > 62.231.75.207.443: Flags [.], ack 495512, win 14139, options [nop,nop,TS val 483099578 ecr 2962413799], length 0
19:39:10.526727 IP 10.5.0.8.53197 > 62.231.75.207.443: Flags [.], ack 507032, win 14139, options [nop,nop,TS val 483099578 ecr 2962413799], length 0
19:39:10.527623 IP 10.5.0.8.53197 > 62.231.75.207.443: Flags [.], ack 518552, win 14184, options [nop,nop,TS val 483099579 ecr 2962413799], length 0
19:39:10.528314 IP 10.5.0.8.53197 > 62.231.75.207.443: Flags [.], ack 530072, win 14184, options [nop,nop,TS val 483099580 ecr 2962413799], length 0
19:39:10.529304 IP 10.5.0.8.53197 > 62.231.75.207.443: Flags [.], ack 541592, win 14184, options [nop,nop,TS val 483099581 ecr 2962413800], length 0
19:39:10.529933 IP 10.5.0.8.53197 > 62.231.75.207.443: Flags [.], ack 553112, win 14184, options [nop,nop,TS val 483099581 ecr 2962413800], length 0
19:39:10.531058 IP 10.5.0.8.53197 > 62.231.75.207.443: Flags [.], ack 564632, win 14094, options [nop,nop,TS val 483099582 ecr 2962413801], length 0
19:39:10.531741 IP 10.5.0.8.53197 > 62.231.75.207.443: Flags [.], ack 576152, win 14184, options [nop,nop,TS val 483099583 ecr 2962413801], length 0
19:39:10.531959 IP 10.5.0.8.53197 > 62.231.75.207.443: Flags [.], ack 578866, win 14189, options [nop,nop,TS val 483099583 ecr 2962413801], length 0
19:39:11.062195 IP6 fe80::383f:ff6f:7e9:f448 > ff02::1:ffff:fffe: ICMP6, neighbor solicitation, who has fe80::ffff:ffff:fffe, length 32
19:39:11.062195 IP6 fe80::383f:ff6f:7e9:f448 > ff02::1:ffff:fffe: ICMP6, neighbor solicitation, who has fe80::ffff:ffff:fffe, length 32
19:39:11.062877 IP 10.5.0.2.54915 > 10.5.0.255.54915: UDP, length 263
19:39:11.062877 IP 10.5.0.2.54915 > 10.5.0.255.54915: UDP, length 263
19:39:11.346916 IP 10.5.0.107.68 > 10.5.0.1.67: BOOTP/DHCP, Request from 00:0c:29:d3:39:8e, length 300
19:39:11.346930 IP 10.5.0.107.68 > 10.5.0.1.67: BOOTP/DHCP, Request from 00:0c:29:d3:39:8e, length 300
19:39:11.369577 IP6 fe80::383f:ff6f:7e9:f448.61940 > ff02::c.1900: UDP, length 146
19:39:11.369577 IP6 fe80::383f:ff6f:7e9:f448.61940 > ff02::c.1900: UDP, length 146
19:39:11.461774 STP 802.1d, Config, Flags [none], bridge-id 8000.a0:f3:c1:b7:c3:4e.8003, length 43
19:39:11.461774 STP 802.1d, Config, Flags [none], bridge-id 8000.a0:f3:c1:b7:c3:4e.8003, length 43
19:39:11.472055 IP 10.5.0.8.60246 > 128.121.22.143.443: Flags [.], ack 30403897, win 4096, length 0
19:39:11.532247 IP6 fe80::383f:ff6f:7e9:f448 > ff02::1:ffff:fffe: ICMP6, neighbor solicitation, who has fe80::ffff:ffff:fffe, length 32
19:39:11.532247 IP6 fe80::383f:ff6f:7e9:f448 > ff02::1:ffff:fffe: ICMP6, neighbor solicitation, who has fe80::ffff:ffff:fffe, length 32
19:39:11.579407 IP 10.5.0.4.41309 > 10.5.0.255.32412: UDP, length 21
19:39:11.579407 IP 10.5.0.4.41309 > 10.5.0.255.32412: UDP, length 21
19:39:11.579790 IP 10.5.0.4.40868 > 10.5.0.255.32414: UDP, length 21
19:39:11.579790 IP 10.5.0.4.40868 > 10.5.0.255.32414: UDP, length 21
19:39:11.695179 IP 10.5.0.8.53200 > 192.168.166.209.24800: Flags [S], seq 473235233, win 65535, options [mss 1460,nop,wscale 5,nop,nop,TS val 483100741 ecr 0,sackOK,eol], length 0
19:39:11.984147 IP 10.5.0.1.49735 > 255.255.255.255.7437: UDP, length 173
19:39:11.984147 IP 10.5.0.1.49735 > 255.255.255.255.7437: UDP, length 173
19:39:12.086738 IP 10.5.0.2.54915 > 10.5.0.255.54915: UDP, length 263
19:39:12.086738 IP 10.5.0.2.54915 > 10.5.0.255.54915: UDP, length 263
19:39:12.598518 IP6 fe80::383f:ff6f:7e9:f448 > ff02::1:ffff:fffe: ICMP6, neighbor solicitation, who has fe80::ffff:ffff:fffe, length 32
19:39:12.598518 IP6 fe80::383f:ff6f:7e9:f448 > ff02::1:ffff:fffe: ICMP6, neighbor solicitation, who has fe80::ffff:ffff:fffe, length 32
19:39:12.696453 IP 10.5.0.8.53200 > 192.168.166.209.24800: Flags [S], seq 473235233, win 65535, options [mss 1460,nop,wscale 5,nop,nop,TS val 483101742 ecr 0,sackOK,eol], length 0
19:39:13.110625 IP 10.5.0.2.54915 > 10.5.0.255.54915: UDP, length 263
19:39:13.110625 IP 10.5.0.2.54915 > 10.5.0.255.54915: UDP, length 263
19:39:13.129529 IP 10.5.0.107.68 > 10.5.0.1.67: BOOTP/DHCP, Request from 00:0c:29:d3:39:8e, length 300
19:39:13.129577 IP 10.5.0.107.68 > 10.5.0.1.67: BOOTP/DHCP, Request from 00:0c:29:d3:39:8e, length 300
19:39:13.412720 IP 10.5.0.8.54369 > 10.5.0.1.53: 40420+ A? ext.todoist.com. (33)
19:39:13.420106 IP 10.5.0.8.53201 > 54.241.137.75.443: Flags [S], seq 1868294208, win 65535, options [mss 1460,nop,wscale 5,nop,nop,TS val 483102465 ecr 0,sackOK,eol], length 0
19:39:13.461702 STP 802.1d, Config, Flags [none], bridge-id 8000.a0:f3:c1:b7:c3:4e.8003, length 43
19:39:13.461702 STP 802.1d, Config, Flags [none], bridge-id 8000.a0:f3:c1:b7:c3:4e.8003, length 43
19:39:13.668461 IP 10.5.0.8.53202 > 54.241.137.75.443: Flags [S], seq 3599702205, win 65535, options [mss 1460,nop,wscale 5,nop,nop,TS val 483102712 ecr 0,sackOK,eol], length 0
19:39:13.686313 IP 10.5.0.8.53201 > 54.241.137.75.443: Flags [.], ack 2819303312, win 4140, options [nop,nop,TS val 483102730 ecr 1949506984], length 0
19:39:13.686343 IP 10.5.0.8.53201 > 54.241.137.75.443: Flags [P.], seq 0:517, ack 1, win 4140, options [nop,nop,TS val 483102730 ecr 1949506984], length 517
19:39:13.698925 IP 10.5.0.8.53200 > 192.168.166.209.24800: Flags [S], seq 473235233, win 65535, options [mss 1460,nop,wscale 5,nop,nop,TS val 483102742 ecr 0,sackOK,eol], length 0
19:39:13.888456 ARP, Request who-has 10.5.0.1 tell 10.5.0.102, length 46
19:39:13.888456 ARP, Request who-has 10.5.0.1 tell 10.5.0.102, length 46
19:39:13.889919 IP 10.5.0.8.53202 > 54.241.137.75.443: Flags [.], ack 1500970978, win 4140, options [nop,nop,TS val 483102932 ecr 1949507046], length 0
19:39:13.900232 IP 10.5.0.8.53201 > 54.241.137.75.443: Flags [.], ack 2695, win 4055, options [nop,nop,TS val 483102941 ecr 1949507051], length 0
19:39:13.900796 IP 10.5.0.8.53201 > 54.241.137.75.443: Flags [P.], seq 517:643, ack 2695, win 4096, options [nop,nop,TS val 483102942 ecr 1949507051], length 126
19:39:14.041163 IP 10.5.0.2.54915 > 10.5.0.255.54915: UDP, length 263
19:39:14.041163 IP 10.5.0.2.54915 > 10.5.0.255.54915: UDP, length 263
19:39:14.081864 IP 10.5.0.107.68 > 10.5.0.1.67: BOOTP/DHCP, Request from 00:0c:29:d3:39:8e, length 300
19:39:14.081888 IP 10.5.0.107.68 > 10.5.0.1.67: BOOTP/DHCP, Request from 00:0c:29:d3:39:8e, length 300
19:39:14.110168 IP 10.5.0.8.53201 > 54.241.137.75.443: Flags [.], ack 2937, win 4088, options [nop,nop,TS val 483103150 ecr 1949507104], length 0
19:39:14.110733 IP 10.5.0.8.53201 > 54.241.137.75.443: Flags [P.], seq 643:1196, ack 2937, win 4096, options [nop,nop,TS val 483103150 ecr 1949507104], length 553
19:39:14.340404 IP 10.5.0.8.53201 > 54.241.137.75.443: Flags [.], ack 3355, win 4082, options [nop,nop,TS val 483103380 ecr 1949507158], length 0
19:39:14.374824 IP 10.5.0.107.68 > 10.5.0.1.67: BOOTP/DHCP, Request from 00:0c:29:d3:39:8e, length 300
19:39:14.374864 IP 10.5.0.107.68 > 10.5.0.1.67: BOOTP/DHCP, Request from 00:0c:29:d3:39:8e, length 300
19:39:14.704700 IP 10.5.0.8.53200 > 192.168.166.209.24800: Flags [S], seq 473235233, win 65535, options [mss 1460,nop,wscale 5,nop,nop,TS val 483103742 ecr 0,sackOK,eol], length 0
19:39:14.909934 IP 10.5.0.1.49735 > 255.255.255.255.7437: UDP, length 173
19:39:14.909934 IP 10.5.0.1.49735 > 255.255.255.255.7437: UDP, length 173
19:39:15.158609 IP 10.5.0.2.54915 > 10.5.0.255.54915: UDP, length 263
19:39:15.158609 IP 10.5.0.2.54915 > 10.5.0.255.54915: UDP, length 263
19:39:15.238161 IP 10.5.0.8.53190 > 62.231.75.236.443: Flags [.], ack 3521806910, win 4120, length 0
19:39:15.277415 IP 10.5.0.107.68 > 10.5.0.1.67: BOOTP/DHCP, Request from 00:0c:29:d3:39:8e, length 300
19:39:15.277471 IP 10.5.0.107.68 > 10.5.0.1.67: BOOTP/DHCP, Request from 00:0c:29:d3:39:8e, length 300
19:39:15.311033 IP6 fe80::383f:ff6f:7e9:f448.61940 > ff02::c.1900: UDP, length 146
19:39:15.311033 IP6 fe80::383f:ff6f:7e9:f448.61940 > ff02::c.1900: UDP, length 146
19:39:15.461768 STP 802.1d, Config, Flags [none], bridge-id 8000.a0:f3:c1:b7:c3:4e.8003, length 43
19:39:15.461768 STP 802.1d, Config, Flags [none], bridge-id 8000.a0:f3:c1:b7:c3:4e.8003, length 43
19:39:15.706306 IP 10.5.0.8.53200 > 192.168.166.209.24800: Flags [S], seq 473235233, win 65535, options [mss 1460,nop,wscale 5,nop,nop,TS val 483104742 ecr 0,sackOK,eol], length 0
19:39:16.080367 IP 10.5.0.2.54915 > 10.5.0.255.54915: UDP, length 263
19:39:16.080367 IP 10.5.0.2.54915 > 10.5.0.255.54915: UDP, length 263
19:39:16.126446 IP 10.5.0.107.68 > 10.5.0.1.67: BOOTP/DHCP, Request from 00:0c:29:d3:39:8e, length 300
19:39:16.126504 IP 10.5.0.107.68 > 10.5.0.1.67: BOOTP/DHCP, Request from 00:0c:29:d3:39:8e, length 300
19:39:16.592278 IP 10.5.0.4.41309 > 10.5.0.255.32412: UDP, length 21
19:39:16.592278 IP 10.5.0.4.41309 > 10.5.0.255.32412: UDP, length 21
19:39:16.707594 IP 10.5.0.8.53200 > 192.168.166.209.24800: Flags [S], seq 473235233, win 65535, options [mss 1460,nop,wscale 5,nop,nop,TS val 483105743 ecr 0,sackOK,eol], length 0
19:39:17.001544 IP6 fe80::383f:ff6f:7e9:f448 > ff02::1:ffff:fffe: ICMP6, neighbor solicitation, who has fe80::ffff:ffff:fffe, length 32
19:39:17.001544 IP6 fe80::383f:ff6f:7e9:f448 > ff02::1:ffff:fffe: ICMP6, neighbor solicitation, who has fe80::ffff:ffff:fffe, length 32
19:39:17.104297 IP 10.5.0.2.54915 > 10.5.0.255.54915: UDP, length 263
19:39:17.104297 IP 10.5.0.2.54915 > 10.5.0.255.54915: UDP, length 263
19:39:17.154788 IP 10.5.0.8.52909 > 82.76.79.103.443: Flags [.], ack 4163950446, win 4096, length 0
19:39:17.513775 STP 802.1d, Config, Flags [none], bridge-id 8000.a0:f3:c1:b7:c3:4e.8003, length 43
19:39:17.513775 STP 802.1d, Config, Flags [none], bridge-id 8000.a0:f3:c1:b7:c3:4e.8003, length 43
19:39:17.615890 IP6 fe80::383f:ff6f:7e9:f448 > ff02::1:ffff:fffe: ICMP6, neighbor solicitation, who has fe80::ffff:ffff:fffe, length 32
19:39:17.615890 IP6 fe80::383f:ff6f:7e9:f448 > ff02::1:ffff:fffe: ICMP6, neighbor solicitation, who has fe80::ffff:ffff:fffe, length 32
19:39:18.025803 IP 10.5.0.1.49735 > 255.255.255.255.7437: UDP, length 173
19:39:18.025803 IP 10.5.0.1.49735 > 255.255.255.255.7437: UDP, length 173
19:39:18.095794 IP 10.5.0.107.68 > 10.5.0.1.67: BOOTP/DHCP, Request from 00:0c:29:d3:39:8e, length 300
19:39:18.095883 IP 10.5.0.107.68 > 10.5.0.1.67: BOOTP/DHCP, Request from 00:0c:29:d3:39:8e, length 300
19:39:18.127907 IP6 fe80::383f:ff6f:7e9:f448 > ff02::1:ff76:6cf7: ICMP6, neighbor solicitation, who has fe80::5e96:9dff:fe76:6cf7, length 32
19:39:18.127907 IP6 fe80::383f:ff6f:7e9:f448 > ff02::1:ff76:6cf7: ICMP6, neighbor solicitation, who has fe80::5e96:9dff:fe76:6cf7, length 32
19:39:18.128735 IP 10.5.0.2.54915 > 10.5.0.255.54915: UDP, length 263
19:39:18.128735 IP 10.5.0.2.54915 > 10.5.0.255.54915: UDP, length 263
19:39:18.333021 IP6 fe80::383f:ff6f:7e9:f448.61940 > ff02::c.1900: UDP, length 146
19:39:18.333021 IP6 fe80::383f:ff6f:7e9:f448.61940 > ff02::c.1900: UDP, length 146
19:39:18.640129 IP6 fe80::383f:ff6f:7e9:f448 > ff02::1:ffff:fffe: ICMP6, neighbor solicitation, who has fe80::ffff:ffff:fffe, length 32
19:39:18.640129 IP6 fe80::383f:ff6f:7e9:f448 > ff02::1:ffff:fffe: ICMP6, neighbor solicitation, who has fe80::ffff:ffff:fffe, length 32
19:39:18.640155 IP6 fe80::383f:ff6f:7e9:f448 > ff02::1:ff76:6cf7: ICMP6, neighbor solicitation, who has fe80::5e96:9dff:fe76:6cf7, length 32
19:39:18.640155 IP6 fe80::383f:ff6f:7e9:f448 > ff02::1:ff76:6cf7: ICMP6, neighbor solicitation, who has fe80::5e96:9dff:fe76:6cf7, length 32
19:39:18.710773 IP 10.5.0.8.53200 > 192.168.166.209.24800: Flags [S], seq 473235233, win 65535, options [mss 1460,nop,wscale 5,nop,nop,TS val 483107743 ecr 0,sackOK,eol], length 0
19:39:18.751414 IP 10.5.0.107.68 > 10.5.0.1.67: BOOTP/DHCP, Request from 00:0c:29:d3:39:8e, length 300
19:39:18.751467 IP 10.5.0.107.68 > 10.5.0.1.67: BOOTP/DHCP, Request from 00:0c:29:d3:39:8e, length 300
19:39:19.038075 IP 10.5.0.107.68 > 10.5.0.1.67: BOOTP/DHCP, Request from 00:0c:29:d3:39:8e, length 300
19:39:19.038093 IP 10.5.0.107.68 > 10.5.0.1.67: BOOTP/DHCP, Request from 00:0c:29:d3:39:8e, length 300
19:39:19.110468 IP 10.5.0.2.54915 > 10.5.0.255.54915: UDP, length 263
19:39:19.110468 IP 10.5.0.2.54915 > 10.5.0.255.54915: UDP, length 263
19:39:19.561908 STP 802.1d, Config, Flags [none], bridge-id 8000.a0:f3:c1:b7:c3:4e.8003, length 43
19:39:19.561908 STP 802.1d, Config, Flags [none], bridge-id 8000.a0:f3:c1:b7:c3:4e.8003, length 43
19:39:19.561930 IP6 fe80::383f:ff6f:7e9:f448 > ff02::1:ff76:6cf7: ICMP6, neighbor solicitation, who has fe80::5e96:9dff:fe76:6cf7, length 32
19:39:19.561930 IP6 fe80::383f:ff6f:7e9:f448 > ff02::1:ff76:6cf7: ICMP6, neighbor solicitation, who has fe80::5e96:9dff:fe76:6cf7, length 32
19:39:19.828511 IP 10.5.0.107.68 > 10.5.0.1.67: BOOTP/DHCP, Request from 00:0c:29:d3:39:8e, length 300
19:39:19.828538 IP 10.5.0.107.68 > 10.5.0.1.67: BOOTP/DHCP, Request from 00:0c:29:d3:39:8e, length 300
19:39:20.176213 IP 10.5.0.2.54915 > 10.5.0.255.54915: UDP, length 263
19:39:20.176213 IP 10.5.0.2.54915 > 10.5.0.255.54915: UDP, length 263
19:39:20.224478 IP 10.5.0.8.60248 > 193.105.64.2.143: Flags [P.], seq 1437764272:1437764325, ack 1312400104, win 4096, options [nop,nop,TS val 483109256 ecr 560519238], length 53
19:39:20.232470 IP 10.5.0.8.60248 > 193.105.64.2.143: Flags [.], ack 70, win 4093, options [nop,nop,TS val 483109264 ecr 560611115], length 0
19:39:20.233126 IP 10.5.0.8.60248 > 193.105.64.2.143: Flags [P.], seq 53:106, ack 70, win 4096, options [nop,nop,TS val 483109264 ecr 560611115], length 53
19:39:20.239479 IP 10.5.0.8.60248 > 193.105.64.2.143: Flags [.], ack 139, win 4093, options [nop,nop,TS val 483109270 ecr 560611121], length 0
19:39:20.239997 IP 10.5.0.8.60248 > 193.105.64.2.143: Flags [P.], seq 106:175, ack 139, win 4096, options [nop,nop,TS val 483109270 ecr 560611121], length 69
19:39:20.247453 IP 10.5.0.8.60248 > 193.105.64.2.143: Flags [.], ack 304, win 4090, options [nop,nop,TS val 483109277 ecr 560611130], length 0
19:39:20.248003 IP 10.5.0.8.60248 > 193.105.64.2.143: Flags [P.], seq 175:260, ack 304, win 4096, options [nop,nop,TS val 483109277 ecr 560611130], length 85
19:39:20.254740 IP 10.5.0.8.60248 > 193.105.64.2.143: Flags [.], ack 421, win 4092, options [nop,nop,TS val 483109284 ecr 560611136], length 0
19:39:20.452685 IP 10.5.0.8.60248 > 193.105.64.2.143: Flags [P.], seq 260:313, ack 421, win 4096, options [nop,nop,TS val 483109481 ecr 560611136], length 53
19:39:20.459354 IP 10.5.0.8.60248 > 193.105.64.2.143: Flags [.], ack 474, win 4094, options [nop,nop,TS val 483109487 ecr 560611342], length 0
19:39:20.645962 IP 10.5.0.107.68 > 10.5.0.1.67: BOOTP/DHCP, Request from 00:0c:29:d3:39:8e, length 300
19:39:20.645976 IP 10.5.0.107.68 > 10.5.0.1.67: BOOTP/DHCP, Request from 00:0c:29:d3:39:8e, length 300
19:39:20.995368 IP 10.5.0.1.49735 > 255.255.255.255.7437: UDP, length 173
19:39:20.995368 IP 10.5.0.1.49735 > 255.255.255.255.7437: UDP, length 173
19:39:21.097642 IP6 fe80::383f:ff6f:7e9:f448 > ff02::1:ff76:6cf7: ICMP6, neighbor solicitation, who has fe80::5e96:9dff:fe76:6cf7, length 32
19:39:21.097642 IP6 fe80::383f:ff6f:7e9:f448 > ff02::1:ff76:6cf7: ICMP6, neighbor solicitation, who has fe80::5e96:9dff:fe76:6cf7, length 32
19:39:21.200280 IP 10.5.0.2.54915 > 10.5.0.255.54915: UDP, length 263
19:39:21.200280 IP 10.5.0.2.54915 > 10.5.0.255.54915: UDP, length 263
19:39:21.201236 IP 10.5.0.8.52678 > 108.160.170.50.443: Flags [.], ack 1026719094, win 4085, options [nop,nop,TS val 483110228 ecr 2257492646], length 0
19:39:21.204548 IP 10.5.0.8.52678 > 108.160.170.50.443: Flags [P.], seq 0:458, ack 1, win 4096, options [nop,nop,TS val 483110230 ecr 2257492646], length 458
19:39:21.311136 IP6 fe80::383f:ff6f:7e9:f448.61940 > ff02::c.1900: UDP, length 146
19:39:21.311136 IP6 fe80::383f:ff6f:7e9:f448.61940 > ff02::c.1900: UDP, length 146
19:39:21.461765 STP 802.1d, Config, Flags [none], bridge-id 8000.a0:f3:c1:b7:c3:4e.8003, length 43
19:39:21.461765 STP 802.1d, Config, Flags [none], bridge-id 8000.a0:f3:c1:b7:c3:4e.8003, length 43
19:39:21.508770 IP 10.5.0.2.17500 > 255.255.255.255.17500: UDP, length 176
19:39:21.508770 IP 10.5.0.2.17500 > 255.255.255.255.17500: UDP, length 176
19:39:21.510987 IP 10.5.0.2.17500 > 10.5.0.255.17500: UDP, length 176
19:39:21.510987 IP 10.5.0.2.17500 > 10.5.0.255.17500: UDP, length 176
19:39:21.511671 IP 10.5.0.2.17500 > 255.255.255.255.17500: UDP, length 176
19:39:21.511671 IP 10.5.0.2.17500 > 255.255.255.255.17500: UDP, length 176
19:39:21.512102 IP 10.5.0.2.17500 > 255.255.255.255.17500: UDP, length 176
19:39:21.512102 IP 10.5.0.2.17500 > 255.255.255.255.17500: UDP, length 176
19:39:21.532022 IP6 fe80::383f:ff6f:7e9:f448 > ff02::1:ff76:6cf7: ICMP6, neighbor solicitation, who has fe80::5e96:9dff:fe76:6cf7, length 32
19:39:21.532022 IP6 fe80::383f:ff6f:7e9:f448 > ff02::1:ff76:6cf7: ICMP6, neighbor solicitation, who has fe80::5e96:9dff:fe76:6cf7, length 32
19:39:21.609693 IP 10.5.0.4.41309 > 10.5.0.255.32412: UDP, length 21
19:39:21.609693 IP 10.5.0.4.41309 > 10.5.0.255.32412: UDP, length 21
19:39:21.609719 IP 10.5.0.4.40868 > 10.5.0.255.32414: UDP, length 21
19:39:21.609719 IP 10.5.0.4.40868 > 10.5.0.255.32414: UDP, length 21
19:39:22.224460 IP 10.5.0.2.54915 > 10.5.0.255.54915: UDP, length 263
19:39:22.224460 IP 10.5.0.2.54915 > 10.5.0.255.54915: UDP, length 263
19:39:22.328450 IP 10.5.0.8.53073 > 74.125.71.189.443: Flags [.], ack 2642777038, win 4094, options [nop,nop,TS val 483111353 ecr 1943788942], length 0
19:39:22.532868 IP6 fe80::383f:ff6f:7e9:f448 > ff02::1:ff76:6cf7: ICMP6, neighbor solicitation, who has fe80::5e96:9dff:fe76:6cf7, length 32
19:39:22.532868 IP6 fe80::383f:ff6f:7e9:f448 > ff02::1:ff76:6cf7: ICMP6, neighbor solicitation, who has fe80::5e96:9dff:fe76:6cf7, length 32
19:39:22.719197 IP 10.5.0.8.53200 > 192.168.166.209.24800: Flags [S], seq 473235233, win 65535, options [mss 1460,nop,wscale 5,nop,nop,TS val 483111743 ecr 0,sackOK,eol], length 0
19:39:23.248381 IP 10.5.0.2.54915 > 10.5.0.255.54915: UDP, length 263
19:39:23.248381 IP 10.5.0.2.54915 > 10.5.0.255.54915: UDP, length 263
19:39:23.555492 STP 802.1d, Config, Flags [none], bridge-id 8000.a0:f3:c1:b7:c3:4e.8003, length 43
19:39:23.555492 STP 802.1d, Config, Flags [none], bridge-id 8000.a0:f3:c1:b7:c3:4e.8003, length 43
19:39:24.067523 IP 10.5.0.1.49735 > 255.255.255.255.7437: UDP, length 173
19:39:24.067523 IP 10.5.0.1.49735 > 255.255.255.255.7437: UDP, length 173
19:39:24.272304 IP 10.5.0.2.54915 > 10.5.0.255.54915: UDP, length 263
19:39:24.272304 IP 10.5.0.2.54915 > 10.5.0.255.54915: UDP, length 263
19:39:24.494278 IP 10.5.0.107.52018 > 54.241.137.75.443: Flags [.], ack 314416096, win 229, options [nop,nop,TS val 80599824 ecr 1949498423], length 0
19:39:24.494293 IP 10.5.0.107.52018 > 54.241.137.75.443: Flags [.], ack 1, win 229, options [nop,nop,TS val 80599824 ecr 1949498423], length 0
19:39:24.797602 IP 54.241.137.75.443 > 10.5.0.107.52018: Flags [.], ack 1, win 57, options [nop,nop,TS val 1949509752 ecr 80588559], length 0
19:39:24.797602 IP 54.241.137.75.443 > 10.5.0.107.52018: Flags [.], ack 1, win 57, options [nop,nop,TS val 1949509752 ecr 80588559], length 0
19:39:25.296407 IP 10.5.0.2.54915 > 10.5.0.255.54915: UDP, length 263
19:39:25.296407 IP 10.5.0.2.54915 > 10.5.0.255.54915: UDP, length 263
19:39:25.398567 IP6 fe80::383f:ff6f:7e9:f448.61940 > ff02::c.1900: UDP, length 146
19:39:25.398567 IP6 fe80::383f:ff6f:7e9:f448.61940 > ff02::c.1900: UDP, length 146
19:39:25.501184 STP 802.1d, Config, Flags [none], bridge-id 8000.a0:f3:c1:b7:c3:4e.8003, length 43
19:39:25.501184 STP 802.1d, Config, Flags [none], bridge-id 8000.a0:f3:c1:b7:c3:4e.8003, length 43
19:39:26.320409 IP 10.5.0.2.54915 > 10.5.0.255.54915: UDP, length 263
19:39:26.320409 IP 10.5.0.2.54915 > 10.5.0.255.54915: UDP, length 263
19:39:26.627451 IP 10.5.0.4.41309 > 10.5.0.255.32412: UDP, length 21
19:39:26.627451 IP 10.5.0.4.41309 > 10.5.0.255.32412: UDP, length 21
19:39:26.627479 IP 10.5.0.4.40868 > 10.5.0.255.32414: UDP, length 21
19:39:26.627479 IP 10.5.0.4.40868 > 10.5.0.255.32414: UDP, length 21
19:39:26.630085 IP 10.5.0.107.68 > 10.5.0.1.67: BOOTP/DHCP, Request from 00:0c:29:d3:39:8e, length 300
19:39:26.630136 IP 10.5.0.107.68 > 10.5.0.1.67: BOOTP/DHCP, Request from 00:0c:29:d3:39:8e, length 300
19:39:26.699404 IP 10.5.0.8.53205 > 204.154.94.81.443: Flags [S], seq 3665619436, win 65535, options [mss 1460,nop,wscale 5,nop,nop,TS val 483115719 ecr 0,sackOK,eol], length 0
19:39:26.699431 IP 10.5.0.8.53637 > 10.5.0.1.53: 51606+ A? ssl-google-analytics.l.google.com. (51)
19:39:26.706526 IP 10.5.0.8.53206 > 216.58.208.104.443: Flags [S], seq 1467260370, win 65535, options [mss 1460,nop,wscale 5,nop,nop,TS val 483115727 ecr 0,sackOK,eol], length 0
19:39:26.749857 IP 10.5.0.8.53206 > 216.58.208.104.443: Flags [.], ack 1010101963, win 4121, options [nop,nop,TS val 483115770 ecr 2445857099], length 0
19:39:26.751344 IP 10.5.0.8.53206 > 216.58.208.104.443: Flags [P.], seq 0:219, ack 1, win 4121, options [nop,nop,TS val 483115771 ecr 2445857099], length 219
19:39:26.784707 IP 10.5.0.8.53206 > 216.58.208.104.443: Flags [.], ack 2837, win 4032, options [nop,nop,TS val 483115804 ecr 2445857145], length 0
19:39:26.784751 IP 10.5.0.8.53206 > 216.58.208.104.443: Flags [.], ack 3985, win 3996, options [nop,nop,TS val 483115804 ecr 2445857145], length 0
19:39:26.784755 IP 10.5.0.8.53206 > 216.58.208.104.443: Flags [.], ack 3985, win 4096, options [nop,nop,TS val 483115804 ecr 2445857145], length 0
19:39:26.792330 IP 10.5.0.8.53206 > 216.58.208.104.443: Flags [P.], seq 219:294, ack 3985, win 4096, options [nop,nop,TS val 483115811 ecr 2445857145], length 75
19:39:26.792349 IP 10.5.0.8.53206 > 216.58.208.104.443: Flags [P.], seq 294:300, ack 3985, win 4096, options [nop,nop,TS val 483115811 ecr 2445857145], length 6
19:39:26.792351 IP 10.5.0.8.53206 > 216.58.208.104.443: Flags [P.], seq 300:345, ack 3985, win 4096, options [nop,nop,TS val 483115811 ecr 2445857145], length 45
19:39:26.822579 IP 10.5.0.8.53206 > 216.58.208.104.443: Flags [.], ack 4036, win 4094, options [nop,nop,TS val 483115840 ecr 2445857184], length 0
19:39:26.822601 IP 10.5.0.8.53206 > 216.58.208.104.443: Flags [.], ack 4093, win 4092, options [nop,nop,TS val 483115840 ecr 2445857184], length 0
19:39:26.822603 IP 10.5.0.8.53206 > 216.58.208.104.443: Flags [.], ack 4138, win 4091, options [nop,nop,TS val 483115840 ecr 2445857184], length 0
19:39:26.823462 IP 10.5.0.8.53206 > 216.58.208.104.443: Flags [P.], seq 345:765, ack 4138, win 4096, options [nop,nop,TS val 483115841 ecr 2445857184], length 420
19:39:26.823624 IP 10.5.0.8.53206 > 216.58.208.104.443: Flags [P.], seq 765:1096, ack 4138, win 4096, options [nop,nop,TS val 483115841 ecr 2445857184], length 331
19:39:26.890358 IP 10.5.0.8.53205 > 204.154.94.81.443: Flags [.], ack 4256650850, win 65535, options [nop,nop,TS val 483115907 ecr 4233588001], length 0
19:39:26.891423 IP 10.5.0.8.53205 > 204.154.94.81.443: Flags [P.], seq 0:183, ack 1, win 65535, options [nop,nop,TS val 483115908 ecr 4233588001], length 183
19:39:26.891675 IP 10.5.0.8.53206 > 216.58.208.104.443: Flags [.], ack 4444, win 4086, options [nop,nop,TS val 483115908 ecr 2445857252], length 0
19:39:26.891688 IP 10.5.0.8.53206 > 216.58.208.104.443: Flags [.], ack 4516, win 4084, options [nop,nop,TS val 483115908 ecr 2445857252], length 0
19:39:26.891690 IP 10.5.0.8.53206 > 216.58.208.104.443: Flags [.], ack 4557, win 4082, options [nop,nop,TS val 483115908 ecr 2445857252], length 0
19:39:26.892417 IP 10.5.0.8.53206 > 216.58.208.104.443: Flags [P.], seq 1096:1141, ack 4557, win 4096, options [nop,nop,TS val 483115909 ecr 2445857252], length 45
19:39:27.006237 IP 10.5.0.1.49735 > 255.255.255.255.7437: UDP, length 173
19:39:27.006237 IP 10.5.0.1.49735 > 255.255.255.255.7437: UDP, length 173
19:39:27.022426 IP6 fe80::383f:ff6f:7e9:f448 > ff02::1:ff76:6cf7: ICMP6, neighbor solicitation, who has fe80::5e96:9dff:fe76:6cf7, length 32
19:39:27.022426 IP6 fe80::383f:ff6f:7e9:f448 > ff02::1:ff76:6cf7: ICMP6, neighbor solicitation, who has fe80::5e96:9dff:fe76:6cf7, length 32
19:39:27.086039 IP 10.5.0.8.53205 > 204.154.94.81.443: Flags [.], ack 2881, win 65535, options [nop,nop,TS val 483116100 ecr 4233588195], length 0
19:39:27.086073 IP 10.5.0.8.53205 > 204.154.94.81.443: Flags [.], ack 4307, win 65535, options [nop,nop,TS val 483116100 ecr 4233588195], length 0
19:39:27.092949 IP 10.5.0.8.53205 > 204.154.94.81.443: Flags [P.], seq 183:258, ack 4307, win 65535, options [nop,nop,TS val 483116106 ecr 4233588195], length 75
19:39:27.092966 IP 10.5.0.8.53205 > 204.154.94.81.443: Flags [P.], seq 258:264, ack 4307, win 65535, options [nop,nop,TS val 483116106 ecr 4233588195], length 6
19:39:27.092968 IP 10.5.0.8.53205 > 204.154.94.81.443: Flags [P.], seq 264:309, ack 4307, win 65535, options [nop,nop,TS val 483116106 ecr 4233588195], length 45
19:39:27.096946 IP 10.5.0.2.5353 > 224.0.0.251.5353: 0 PTR (QM)? _googlecast._tcp.local. (40)
19:39:27.096946 IP 10.5.0.2.5353 > 224.0.0.251.5353: 0 PTR (QM)? _googlecast._tcp.local. (40)
19:39:27.097483 IP6 fe80::383f:ff6f:7e9:f448.5353 > ff02::fb.5353: 0 PTR (QM)? _googlecast._tcp.local. (40)
19:39:27.097483 IP6 fe80::383f:ff6f:7e9:f448.5353 > ff02::fb.5353: 0 PTR (QM)? _googlecast._tcp.local. (40)
19:39:27.104261 IP 10.5.0.2.63231 > 239.255.255.250.1900: UDP, length 174
19:39:27.105991 IP 10.5.0.4.1900 > 239.255.255.250.1900: UDP, length 1024
19:39:27.106818 ARP, Request who-has 10.5.0.109 tell 10.5.0.2, length 46
19:39:27.106818 ARP, Request who-has 10.5.0.109 tell 10.5.0.2, length 46
19:39:27.107088 ARP, Request who-has 10.5.0.5 tell 10.5.0.2, length 46
19:39:27.107088 ARP, Request who-has 10.5.0.5 tell 10.5.0.2, length 46
19:39:27.180750 IP 10.5.0.100.5353 > 224.0.0.251.5353: 0*- [0q] 1/0/3 PTR Chromecast6733._googlecast._tcp.local. (370)
19:39:27.180750 IP 10.5.0.100.5353 > 224.0.0.251.5353: 0*- [0q] 1/0/3 PTR Chromecast6733._googlecast._tcp.local. (370)
19:39:27.223088 IP 10.5.0.2.54915 > 10.5.0.255.54915: UDP, length 263
19:39:27.223088 IP 10.5.0.2.54915 > 10.5.0.255.54915: UDP, length 263
19:39:27.298002 IP 10.5.0.8.53205 > 204.154.94.81.443: Flags [.], ack 4313, win 65535, options [nop,nop,TS val 483116310 ecr 4233588395], length 0
19:39:27.550018 STP 802.1d, Config, Flags [none], bridge-id 8000.a0:f3:c1:b7:c3:4e.8003, length 43
19:39:27.550018 STP 802.1d, Config, Flags [none], bridge-id 8000.a0:f3:c1:b7:c3:4e.8003, length 43
19:39:27.551612 IP 10.5.0.8.53205 > 204.154.94.81.443: Flags [.], ack 4358, win 65535, options [nop,nop,TS val 483116563 ecr 4233588599], length 0
19:39:27.552746 IP 10.5.0.8.53205 > 204.154.94.81.443: Flags [P.], seq 309:629, ack 4358, win 65535, options [nop,nop,TS val 483116564 ecr 4233588599], length 320
19:39:27.552996 IP 10.5.0.8.53205 > 204.154.94.81.443: Flags [P.], seq 629:815, ack 4358, win 65535, options [nop,nop,TS val 483116564 ecr 4233588599], length 186
19:39:27.626357 IP 10.5.0.107.68 > 10.5.0.1.67: BOOTP/DHCP, Request from 00:0c:29:d3:39:8e, length 300
19:39:27.626414 IP 10.5.0.107.68 > 10.5.0.1.67: BOOTP/DHCP, Request from 00:0c:29:d3:39:8e, length 300
19:39:27.755981 IP 10.5.0.8.53205 > 204.154.94.81.443: Flags [.], ack 4727, win 65535, options [nop,nop,TS val 483116765 ecr 4233588867], length 0
19:39:27.774641 IP 10.5.0.8.53205 > 204.154.94.81.443: Flags [P.], seq 815:1136, ack 4727, win 65535, options [nop,nop,TS val 483116784 ecr 4233588867], length 321
19:39:27.774661 IP 10.5.0.8.53205 > 204.154.94.81.443: Flags [P.], seq 1136:1332, ack 4727, win 65535, options [nop,nop,TS val 483116784 ecr 4233588867], length 196
19:39:27.972518 IP 10.5.0.8.53205 > 204.154.94.81.443: Flags [.], ack 5767, win 65535, options [nop,nop,TS val 483116981 ecr 4233589084], length 0
19:39:27.976316 IP 10.5.0.8.53205 > 204.154.94.81.443: Flags [P.], seq 1332:1653, ack 5767, win 65535, options [nop,nop,TS val 483116985 ecr 4233589084], length 321
19:39:27.976361 IP 10.5.0.8.53205 > 204.154.94.81.443: Flags [P.], seq 1653:1962, ack 5767, win 65535, options [nop,nop,TS val 483116985 ecr 4233589084], length 309
19:39:28.032132 ARP, Request who-has 10.5.0.109 tell 10.5.0.2, length 46
19:39:28.032132 ARP, Request who-has 10.5.0.109 tell 10.5.0.2, length 46
19:39:28.032612 ARP, Request who-has 10.5.0.5 tell 10.5.0.2, length 46
19:39:28.032612 ARP, Request who-has 10.5.0.5 tell 10.5.0.2, length 46
19:39:28.097330 IP 10.5.0.2.5353 > 224.0.0.251.5353: 0 PTR (QM)? _googlecast._tcp.local. (40)
19:39:28.097330 IP 10.5.0.2.5353 > 224.0.0.251.5353: 0 PTR (QM)? _googlecast._tcp.local. (40)
19:39:28.097976 IP6 fe80::383f:ff6f:7e9:f448.5353 > ff02::fb.5353: 0 PTR (QM)? _googlecast._tcp.local. (40)
19:39:28.097976 IP6 fe80::383f:ff6f:7e9:f448.5353 > ff02::fb.5353: 0 PTR (QM)? _googlecast._tcp.local. (40)
19:39:28.104701 IP 10.5.0.2.63231 > 239.255.255.250.1900: UDP, length 174
19:39:28.176458 IP 10.5.0.8.53205 > 204.154.94.81.443: Flags [.], ack 6139, win 65535, options [nop,nop,TS val 483117184 ecr 4233589288], length 0
19:39:28.179263 IP 10.5.0.8.53205 > 204.154.94.81.443: Flags [P.], seq 1962:2272, ack 6139, win 65535, options [nop,nop,TS val 483117187 ecr 4233589288], length 310
19:39:28.179430 IP 10.5.0.8.53205 > 204.154.94.81.443: Flags [P.], seq 2272:2449, ack 6139, win 65535, options [nop,nop,TS val 483117187 ecr 4233589288], length 177
19:39:28.195955 IP 10.5.0.100.5353 > 224.0.0.251.5353: 0*- [0q] 1/0/3 PTR Chromecast6733._googlecast._tcp.local. (370)
19:39:28.195955 IP 10.5.0.100.5353 > 224.0.0.251.5353: 0*- [0q] 1/0/3 PTR Chromecast6733._googlecast._tcp.local. (370)
19:39:28.237385 IP 10.5.0.2.54915 > 10.5.0.255.54915: UDP, length 263
19:39:28.237385 IP 10.5.0.2.54915 > 10.5.0.255.54915: UDP, length 263
19:39:28.311795 IP6 fe80::383f:ff6f:7e9:f448.61940 > ff02::c.1900: UDP, length 146
19:39:28.311795 IP6 fe80::383f:ff6f:7e9:f448.61940 > ff02::c.1900: UDP, length 146
19:39:28.375960 IP 10.5.0.8.53205 > 204.154.94.81.443: Flags [.], ack 6667, win 65535, options [nop,nop,TS val 483117382 ecr 4233589486], length 0
19:39:28.532297 IP6 fe80::383f:ff6f:7e9:f448 > ff02::1:ff76:6cf7: ICMP6, neighbor solicitation, who has fe80::5e96:9dff:fe76:6cf7, length 32
19:39:28.532297 IP6 fe80::383f:ff6f:7e9:f448 > ff02::1:ff76:6cf7: ICMP6, neighbor solicitation, who has fe80::5e96:9dff:fe76:6cf7, length 32
19:39:28.701639 IP 10.5.0.8.53207 > 192.168.166.209.24800: Flags [S], seq 2709440758, win 65535, options [mss 1460,nop,wscale 5,nop,nop,TS val 483117706 ecr 0,sackOK,eol], length 0
19:39:29.084935 ARP, Request who-has 10.5.0.109 tell 10.5.0.2, length 46
19:39:29.084935 ARP, Request who-has 10.5.0.109 tell 10.5.0.2, length 46
19:39:29.187478 IP 10.5.0.2.63231 > 239.255.255.250.1900: UDP, length 174
19:39:29.290101 IP 10.5.0.2.54915 > 10.5.0.255.54915: UDP, length 263
19:39:29.290101 IP 10.5.0.2.54915 > 10.5.0.255.54915: UDP, length 263
19:39:29.422950 IP 10.5.0.107.52017 > 54.241.137.75.443: Flags [.], ack 4111304982, win 319, options [nop,nop,TS val 80601056 ecr 1949499673], length 0
19:39:29.422975 IP 10.5.0.107.52017 > 54.241.137.75.443: Flags [.], ack 1, win 319, options [nop,nop,TS val 80601056 ecr 1949499673], length 0
19:39:29.462014 STP 802.1d, Config, Flags [none], bridge-id 8000.a0:f3:c1:b7:c3:4e.8003, length 43
19:39:29.462014 STP 802.1d, Config, Flags [none], bridge-id 8000.a0:f3:c1:b7:c3:4e.8003, length 43
19:39:29.501966 ARP, Request who-has 10.5.0.1 tell 10.5.0.107, length 28
19:39:29.501987 ARP, Request who-has 10.5.0.1 tell 10.5.0.107, length 28
19:39:29.503149 ARP, Reply 10.5.0.1 is-at a0:f3:c1:b7:c3:4e, length 46
19:39:29.503149 ARP, Reply 10.5.0.1 is-at a0:f3:c1:b7:c3:4e, length 46
19:39:29.637886 IP 54.241.137.75.443 > 10.5.0.107.52017: Flags [.], ack 1, win 65, options [nop,nop,TS val 1949510984 ecr 80589815], length 0
19:39:29.637886 IP 54.241.137.75.443 > 10.5.0.107.52017: Flags [.], ack 1, win 65, options [nop,nop,TS val 1949510984 ecr 80589815], length 0
19:39:29.702868 IP 10.5.0.8.53207 > 192.168.166.209.24800: Flags [S], seq 2709440758, win 65535, options [mss 1460,nop,wscale 5,nop,nop,TS val 483118706 ecr 0,sackOK,eol], length 0
19:39:30.108931 IP 10.5.0.1.49735 > 255.255.255.255.7437: UDP, length 173
19:39:30.108931 IP 10.5.0.1.49735 > 255.255.255.255.7437: UDP, length 173
19:39:30.211524 IP 10.5.0.2.5353 > 224.0.0.251.5353: 0 PTR (QM)? _googlecast._tcp.local. (40)
19:39:30.211524 IP 10.5.0.2.5353 > 224.0.0.251.5353: 0 PTR (QM)? _googlecast._tcp.local. (40)
19:39:30.211638 IP6 fe80::383f:ff6f:7e9:f448.5353 > ff02::fb.5353: 0 PTR (QM)? _googlecast._tcp.local. (40)
19:39:30.211638 IP6 fe80::383f:ff6f:7e9:f448.5353 > ff02::fb.5353: 0 PTR (QM)? _googlecast._tcp.local. (40)
19:39:30.211854 ARP, Request who-has 10.5.0.109 tell 10.5.0.2, length 46
19:39:30.211854 ARP, Request who-has 10.5.0.109 tell 10.5.0.2, length 46
19:39:30.211883 ARP, Request who-has 10.5.0.5 tell 10.5.0.2, length 46
19:39:30.211883 ARP, Request who-has 10.5.0.5 tell 10.5.0.2, length 46
19:39:30.212572 IP 10.5.0.2.63231 > 239.255.255.250.1900: UDP, length 174
19:39:30.213297 IP 10.5.0.100.5353 > 224.0.0.251.5353: 0*- [0q] 1/0/3 PTR Chromecast6733._googlecast._tcp.local. (370)
19:39:30.213297 IP 10.5.0.100.5353 > 224.0.0.251.5353: 0*- [0q] 1/0/3 PTR Chromecast6733._googlecast._tcp.local. (370)
19:39:30.314007 IP 10.5.0.2.54915 > 10.5.0.255.54915: UDP, length 263
19:39:30.314007 IP 10.5.0.2.54915 > 10.5.0.255.54915: UDP, length 263
19:39:30.501628 IP 10.5.0.107.68 > 10.5.0.1.67: BOOTP/DHCP, Request from 00:0c:29:d3:39:8e, length 300
19:39:30.501695 IP 10.5.0.107.68 > 10.5.0.1.67: BOOTP/DHCP, Request from 00:0c:29:d3:39:8e, length 300
19:39:30.548325 IP 10.5.0.107.68 > 10.5.0.1.67: BOOTP/DHCP, Request from 00:0c:29:d3:39:8e, length 300
19:39:30.548387 IP 10.5.0.107.68 > 10.5.0.1.67: BOOTP/DHCP, Request from 00:0c:29:d3:39:8e, length 300
19:39:30.704179 IP 10.5.0.8.53207 > 192.168.166.209.24800: Flags [S], seq 2709440758, win 65535, options [mss 1460,nop,wscale 5,nop,nop,TS val 483119707 ecr 0,sackOK,eol], length 0
19:39:31.133101 ARP, Request who-has 10.5.0.109 tell 10.5.0.2, length 46
19:39:31.133101 ARP, Request who-has 10.5.0.109 tell 10.5.0.2, length 46
19:39:31.133176 ARP, Request who-has 10.5.0.5 tell 10.5.0.2, length 46
19:39:31.133176 ARP, Request who-has 10.5.0.5 tell 10.5.0.2, length 46
19:39:31.338025 IP 10.5.0.2.54915 > 10.5.0.255.54915: UDP, length 263
19:39:31.338025 IP 10.5.0.2.54915 > 10.5.0.255.54915: UDP, length 263
19:39:31.338531 IP6 fe80::383f:ff6f:7e9:f448.61940 > ff02::c.1900: UDP, length 146
19:39:31.338531 IP6 fe80::383f:ff6f:7e9:f448.61940 > ff02::c.1900: UDP, length 146
19:39:31.399391 IP 10.5.0.107.68 > 10.5.0.1.67: BOOTP/DHCP, Request from 00:0c:29:d3:39:8e, length 300
19:39:31.399448 IP 10.5.0.107.68 > 10.5.0.1.67: BOOTP/DHCP, Request from 00:0c:29:d3:39:8e, length 300
19:39:31.462092 STP 802.1d, Config, Flags [none], bridge-id 8000.a0:f3:c1:b7:c3:4e.8003, length 43
19:39:31.462092 STP 802.1d, Config, Flags [none], bridge-id 8000.a0:f3:c1:b7:c3:4e.8003, length 43
19:39:31.494617 IP 10.5.0.107.68 > 10.5.0.1.67: BOOTP/DHCP, Request from 00:0c:29:d3:39:8e, length 300
19:39:31.494677 IP 10.5.0.107.68 > 10.5.0.1.67: BOOTP/DHCP, Request from 00:0c:29:d3:39:8e, length 300
19:39:31.576648 IP 10.5.0.107.68 > 10.5.0.1.67: BOOTP/DHCP, Request from 00:0c:29:d3:39:8e, length 300
19:39:31.576761 IP 10.5.0.107.68 > 10.5.0.1.67: BOOTP/DHCP, Request from 00:0c:29:d3:39:8e, length 300
19:39:31.579394 IP 10.5.0.4.41309 > 10.5.0.255.32412: UDP, length 21
19:39:31.579394 IP 10.5.0.4.41309 > 10.5.0.255.32412: UDP, length 21
19:39:31.579738 IP 10.5.0.4.40868 > 10.5.0.255.32414: UDP, length 21
19:39:31.579738 IP 10.5.0.4.40868 > 10.5.0.255.32414: UDP, length 21
19:39:31.704244 IP 10.5.0.8.53207 > 192.168.166.209.24800: Flags [S], seq 2709440758, win 65535, options [mss 1460,nop,wscale 5,nop,nop,TS val 483120707 ecr 0,sackOK,eol], length 0
19:39:31.997511 IP 10.5.0.8.60225 > 74.125.71.188.5228: Flags [.], ack 3242097975, win 4096, length 0
19:39:32.032617 ARP, Request who-has 10.5.0.109 tell 10.5.0.2, length 46
19:39:32.032617 ARP, Request who-has 10.5.0.109 tell 10.5.0.2, length 46
19:39:32.033202 ARP, Request who-has 10.5.0.5 tell 10.5.0.2, length 46
19:39:32.033202 ARP, Request who-has 10.5.0.5 tell 10.5.0.2, length 46
19:39:32.294367 IP 10.5.0.107.68 > 10.5.0.1.67: BOOTP/DHCP, Request from 00:0c:29:d3:39:8e, length 300
19:39:32.294400 IP 10.5.0.107.68 > 10.5.0.1.67: BOOTP/DHCP, Request from 00:0c:29:d3:39:8e, length 300
19:39:32.361955 IP 10.5.0.2.54915 > 10.5.0.255.54915: UDP, length 263
19:39:32.361955 IP 10.5.0.2.54915 > 10.5.0.255.54915: UDP, length 263
19:39:32.705811 IP 10.5.0.8.53207 > 192.168.166.209.24800: Flags [S], seq 2709440758, win 65535, options [mss 1460,nop,wscale 5,nop,nop,TS val 483121707 ecr 0,sackOK,eol], length 0
19:39:33.078843 IP 10.5.0.1.49735 > 255.255.255.255.7437: UDP, length 173
19:39:33.078843 IP 10.5.0.1.49735 > 255.255.255.255.7437: UDP, length 173
19:39:33.181125 ARP, Request who-has 10.5.0.5 tell 10.5.0.2, length 46
19:39:33.181125 ARP, Request who-has 10.5.0.5 tell 10.5.0.2, length 46
19:39:33.181198 ARP, Request who-has 10.5.0.109 tell 10.5.0.2, length 46
19:39:33.181198 ARP, Request who-has 10.5.0.109 tell 10.5.0.2, length 46
19:39:33.386012 IP 10.5.0.2.54915 > 10.5.0.255.54915: UDP, length 263
19:39:33.386012 IP 10.5.0.2.54915 > 10.5.0.255.54915: UDP, length 263
19:39:33.488337 STP 802.1d, Config, Flags [none], bridge-id 8000.a0:f3:c1:b7:c3:4e.8003, length 43
19:39:33.488337 STP 802.1d, Config, Flags [none], bridge-id 8000.a0:f3:c1:b7:c3:4e.8003, length 43
19:39:33.684203 IP 10.5.0.107.68 > 10.5.0.1.67: BOOTP/DHCP, Request from 00:0c:29:d3:39:8e, length 300
19:39:33.684239 IP 10.5.0.107.68 > 10.5.0.1.67: BOOTP/DHCP, Request from 00:0c:29:d3:39:8e, length 300
19:39:33.707437 IP 10.5.0.8.53207 > 192.168.166.209.24800: Flags [S], seq 2709440758, win 65535, options [mss 1460,nop,wscale 5,nop,nop,TS val 483122707 ecr 0,sackOK,eol], length 0
19:39:34.102539 ARP, Request who-has 10.5.0.5 tell 10.5.0.2, length 46
19:39:34.102539 ARP, Request who-has 10.5.0.5 tell 10.5.0.2, length 46
19:39:34.102585 ARP, Request who-has 10.5.0.109 tell 10.5.0.2, length 46
19:39:34.102585 ARP, Request who-has 10.5.0.109 tell 10.5.0.2, length 46
19:39:34.410021 IP 10.5.0.2.54915 > 10.5.0.255.54915: UDP, length 263
19:39:34.410021 IP 10.5.0.2.54915 > 10.5.0.255.54915: UDP, length 263
19:39:34.717320 IP 10.5.0.4.40535 > 239.255.255.250.1900: UDP, length 173
19:39:34.717768 IP 10.5.0.4.40535 > 239.255.255.250.1900: UDP, length 173
19:39:35.126709 ARP, Request who-has 10.5.0.5 tell 10.5.0.2, length 46
19:39:35.126709 ARP, Request who-has 10.5.0.5 tell 10.5.0.2, length 46
19:39:35.126760 ARP, Request who-has 10.5.0.109 tell 10.5.0.2, length 46
19:39:35.126760 ARP, Request who-has 10.5.0.109 tell 10.5.0.2, length 46
19:39:35.331600 IP6 fe80::383f:ff6f:7e9:f448.61940 > ff02::c.1900: UDP, length 146
19:39:35.331600 IP6 fe80::383f:ff6f:7e9:f448.61940 > ff02::c.1900: UDP, length 146
19:39:35.428391 IP 10.5.0.8.17500 > 255.255.255.255.17500: UDP, length 176
19:39:35.428391 IP 10.5.0.8.17500 > 255.255.255.255.17500: UDP, length 176
19:39:35.428654 IP 10.5.0.8.17500 > 10.5.0.255.17500: UDP, length 176
19:39:35.428654 IP 10.5.0.8.17500 > 10.5.0.255.17500: UDP, length 176
19:39:35.429010 IP 192.168.77.1.17500 > 192.168.77.255.17500: UDP, length 176
19:39:35.433985 IP 10.5.0.2.54915 > 10.5.0.255.54915: UDP, length 263
19:39:35.433985 IP 10.5.0.2.54915 > 10.5.0.255.54915: UDP, length 263
19:39:35.461939 STP 802.1d, Config, Flags [none], bridge-id 8000.a0:f3:c1:b7:c3:4e.8003, length 43
19:39:35.461939 STP 802.1d, Config, Flags [none], bridge-id 8000.a0:f3:c1:b7:c3:4e.8003, length 43
19:39:35.711138 IP 10.5.0.8.53207 > 192.168.166.209.24800: Flags [S], seq 2709440758, win 65535, options [mss 1460,nop,wscale 5,nop,nop,TS val 483124707 ecr 0,sackOK,eol], length 0
19:39:35.954393 IP 10.5.0.107.47596 > 64.233.166.188.5228: Flags [.], ack 971000521, win 245, options [nop,nop,TS val 80602689 ecr 1954649220], length 0
19:39:35.954418 IP 10.5.0.107.47596 > 64.233.166.188.5228: Flags [.], ack 1, win 245, options [nop,nop,TS val 80602689 ecr 1954649220], length 0
19:39:36.014552 IP 64.233.166.188.5228 > 10.5.0.107.47596: Flags [.], ack 1, win 358, options [nop,nop,TS val 1954694278 ecr 80444983], length 0
19:39:36.014552 IP 64.233.166.188.5228 > 10.5.0.107.47596: Flags [.], ack 1, win 358, options [nop,nop,TS val 1954694278 ecr 80444983], length 0
19:39:36.078122 IP 10.5.0.1.49735 > 255.255.255.255.7437: UDP, length 173
19:39:36.078122 IP 10.5.0.1.49735 > 255.255.255.255.7437: UDP, length 173
19:39:36.103699 ARP, Request who-has 10.5.0.109 tell 10.5.0.2, length 46
19:39:36.103699 ARP, Request who-has 10.5.0.109 tell 10.5.0.2, length 46
19:39:36.104178 ARP, Request who-has 10.5.0.5 tell 10.5.0.2, length 46
19:39:36.104178 ARP, Request who-has 10.5.0.5 tell 10.5.0.2, length 46
19:39:36.458100 IP 10.5.0.2.54915 > 10.5.0.255.54915: UDP, length 263
19:39:36.458100 IP 10.5.0.2.54915 > 10.5.0.255.54915: UDP, length 263
19:39:36.458618 IP 10.5.0.4.3029 > 239.255.255.250.1900: UDP, length 173
19:39:36.459101 IP 10.5.0.4.3029 > 239.255.255.250.1900: UDP, length 173
19:39:36.662867 IP 10.5.0.4.41309 > 10.5.0.255.32412: UDP, length 21
19:39:36.662867 IP 10.5.0.4.41309 > 10.5.0.255.32412: UDP, length 21
19:39:36.662906 IP 10.5.0.4.40868 > 10.5.0.255.32414: UDP, length 21
19:39:36.662906 IP 10.5.0.4.40868 > 10.5.0.255.32414: UDP, length 21
19:39:36.717807 IP 10.5.0.107.68 > 10.5.0.1.67: BOOTP/DHCP, Request from 00:0c:29:d3:39:8e, length 300
19:39:36.717865 IP 10.5.0.107.68 > 10.5.0.1.67: BOOTP/DHCP, Request from 00:0c:29:d3:39:8e, length 300
19:39:37.072561 ARP, Request who-has 10.5.0.109 tell 10.5.0.2, length 46
19:39:37.072561 ARP, Request who-has 10.5.0.109 tell 10.5.0.2, length 46
19:39:37.379656 IP 10.5.0.2.54915 > 10.5.0.255.54915: UDP, length 263
19:39:37.379656 IP 10.5.0.2.54915 > 10.5.0.255.54915: UDP, length 263
19:39:37.481815 STP 802.1d, Config, Flags [none], bridge-id 8000.a0:f3:c1:b7:c3:4e.8003, length 43
19:39:37.481815 STP 802.1d, Config, Flags [none], bridge-id 8000.a0:f3:c1:b7:c3:4e.8003, length 43
19:39:38.096241 ARP, Request who-has 10.5.0.109 tell 10.5.0.2, length 46
19:39:38.096241 ARP, Request who-has 10.5.0.109 tell 10.5.0.2, length 46
19:39:38.096298 ARP, Request who-has 10.5.0.5 tell 10.5.0.2, length 46
19:39:38.096298 ARP, Request who-has 10.5.0.5 tell 10.5.0.2, length 46
19:39:38.403593 IP6 fe80::383f:ff6f:7e9:f448.61940 > ff02::c.1900: UDP, length 146
19:39:38.403593 IP6 fe80::383f:ff6f:7e9:f448.61940 > ff02::c.1900: UDP, length 146
19:39:38.489177 IP 10.5.0.107.68 > 10.5.0.1.67: BOOTP/DHCP, Request from 00:0c:29:d3:39:8e, length 300
19:39:38.489245 IP 10.5.0.107.68 > 10.5.0.1.67: BOOTP/DHCP, Request from 00:0c:29:d3:39:8e, length 300
19:39:39.120198 ARP, Request who-has 10.5.0.5 tell 10.5.0.2, length 46
19:39:39.120198 ARP, Request who-has 10.5.0.5 tell 10.5.0.2, length 46
19:39:39.120255 ARP, Request who-has 10.5.0.109 tell 10.5.0.2, length 46
19:39:39.120255 ARP, Request who-has 10.5.0.109 tell 10.5.0.2, length 46
19:39:39.427720 IP 10.5.0.2.54915 > 10.5.0.255.54915: UDP, length 263
19:39:39.427720 IP 10.5.0.2.54915 > 10.5.0.255.54915: UDP, length 263
19:39:39.530067 STP 802.1d, Config, Flags [none], bridge-id 8000.a0:f3:c1:b7:c3:4e.8003, length 43
19:39:39.530067 STP 802.1d, Config, Flags [none], bridge-id 8000.a0:f3:c1:b7:c3:4e.8003, length 43
19:39:39.712510 IP 10.5.0.8.53207 > 192.168.166.209.24800: Flags [S], seq 2709440758, win 65535, options [mss 1460,nop,wscale 5,nop,nop,TS val 483128708 ecr 0,sackOK,eol], length 0
19:39:40.094766 IP 10.5.0.107.68 > 10.5.0.1.67: BOOTP/DHCP, Request from 00:0c:29:d3:39:8e, length 300
19:39:40.094805 IP 10.5.0.107.68 > 10.5.0.1.67: BOOTP/DHCP, Request from 00:0c:29:d3:39:8e, length 300
19:39:40.144425 ARP, Request who-has 10.5.0.5 tell 10.5.0.2, length 46
19:39:40.144425 ARP, Request who-has 10.5.0.5 tell 10.5.0.2, length 46
19:39:40.144498 ARP, Request who-has 10.5.0.109 tell 10.5.0.2, length 46
19:39:40.144498 ARP, Request who-has 10.5.0.109 tell 10.5.0.2, length 46
19:39:40.451862 IP 10.5.0.2.54915 > 10.5.0.255.54915: UDP, length 263
19:39:40.451862 IP 10.5.0.2.54915 > 10.5.0.255.54915: UDP, length 263
19:39:40.568074 IP 10.5.0.107.68 > 10.5.0.1.67: BOOTP/DHCP, Request from 00:0c:29:d3:39:8e, length 300
19:39:40.568096 IP 10.5.0.107.68 > 10.5.0.1.67: BOOTP/DHCP, Request from 00:0c:29:d3:39:8e, length 300
19:39:40.586294 IP 10.5.0.8.53197 > 62.231.75.207.443: Flags [.], ack 578867, win 14229, options [nop,nop,TS val 483129580 ecr 2962443852], length 0
19:39:40.686491 IP 10.5.0.2.58123 > 239.255.255.250.1900: UDP, length 174
19:39:41.065764 ARP, Request who-has 10.5.0.5 tell 10.5.0.2, length 46
19:39:41.065764 ARP, Request who-has 10.5.0.5 tell 10.5.0.2, length 46
19:39:41.066096 ARP, Request who-has 10.5.0.109 tell 10.5.0.2, length 46
19:39:41.066096 ARP, Request who-has 10.5.0.109 tell 10.5.0.2, length 46
19:39:41.168952 IP 10.5.0.4.33050 > 239.255.255.250.1900: UDP, length 422
19:39:41.169356 IP 10.5.0.4.33050 > 239.255.255.250.1900: UDP, length 431
19:39:41.170647 IP 10.5.0.4.33050 > 239.255.255.250.1900: UDP, length 474
19:39:41.171438 IP 10.5.0.4.41311 > 239.255.255.250.1900: UDP, length 488
19:39:41.172249 IP 10.5.0.4.58102 > 239.255.255.250.1900: UDP, length 486
19:39:41.173337 IP 10.5.0.4.57276 > 239.255.255.250.1900: UDP, length 502
19:39:41.373228 IP6 fe80::383f:ff6f:7e9:f448.61940 > ff02::c.1900: UDP, length 146
19:39:41.373228 IP6 fe80::383f:ff6f:7e9:f448.61940 > ff02::c.1900: UDP, length 146
19:39:41.579366 IP 10.5.0.4.41309 > 10.5.0.255.32412: UDP, length 21
19:39:41.579366 IP 10.5.0.4.41309 > 10.5.0.255.32412: UDP, length 21
19:39:41.579658 IP 10.5.0.4.40868 > 10.5.0.255.32414: UDP, length 21
19:39:41.579658 IP 10.5.0.4.40868 > 10.5.0.255.32414: UDP, length 21
19:39:41.782788 IP 10.5.0.2.58123 > 239.255.255.250.1900: UDP, length 174
19:39:41.883485 IP 192.168.77.1.5353 > 224.0.0.251.5353: 0 PTR (QM)? _ipp._tcp.local. (33)
19:39:43.113863 ARP, Request who-has 10.5.0.109 tell 10.5.0.2, length 46
19:39:43.113863 ARP, Request who-has 10.5.0.109 tell 10.5.0.2, length 46
19:39:43.113911 ARP, Request who-has 10.5.0.5 tell 10.5.0.2, length 46
19:39:43.113911 ARP, Request who-has 10.5.0.5 tell 10.5.0.2, length 46
19:39:43.319204 IP 10.5.0.107.68 > 10.5.0.1.67: BOOTP/DHCP, Request from 00:0c:29:d3:39:8e, length 300
19:39:43.319238 IP 10.5.0.107.68 > 10.5.0.1.67: BOOTP/DHCP, Request from 00:0c:29:d3:39:8e, length 300
19:39:43.446242 IP 10.5.0.2.54915 > 10.5.0.255.54915: UDP, length 263
19:39:43.446242 IP 10.5.0.2.54915 > 10.5.0.255.54915: UDP, length 263
19:39:43.462082 STP 802.1d, Config, Flags [none], bridge-id 8000.a0:f3:c1:b7:c3:4e.8003, length 43
19:39:43.462082 STP 802.1d, Config, Flags [none], bridge-id 8000.a0:f3:c1:b7:c3:4e.8003, length 43
19:39:44.137970 ARP, Request who-has 10.5.0.109 tell 10.5.0.2, length 46
19:39:44.137970 ARP, Request who-has 10.5.0.109 tell 10.5.0.2, length 46
19:39:44.138006 ARP, Request who-has 10.5.0.5 tell 10.5.0.2, length 46
19:39:44.138006 ARP, Request who-has 10.5.0.5 tell 10.5.0.2, length 46
19:39:44.464007 IP 192.168.77.1.5353 > 224.0.0.251.5353: 0 PTR (QM)? _ipp._tcp.local. (33)
19:39:44.547684 IP 10.5.0.2.54915 > 10.5.0.255.54915: UDP, length 263
19:39:44.547684 IP 10.5.0.2.54915 > 10.5.0.255.54915: UDP, length 263
19:39:45.162090 IP 10.5.0.1.49735 > 255.255.255.255.7437: UDP, length 173
19:39:45.162090 IP 10.5.0.1.49735 > 255.255.255.255.7437: UDP, length 173
19:39:45.267794 IP 10.5.0.107.68 > 10.5.0.1.67: BOOTP/DHCP, Request from 00:0c:29:d3:39:8e, length 300
19:39:45.267866 IP 10.5.0.107.68 > 10.5.0.1.67: BOOTP/DHCP, Request from 00:0c:29:d3:39:8e, length 300
19:39:45.312932 IP6 fe80::383f:ff6f:7e9:f448.61940 > ff02::c.1900: UDP, length 146
19:39:45.312932 IP6 fe80::383f:ff6f:7e9:f448.61940 > ff02::c.1900: UDP, length 146
19:39:45.462175 STP 802.1d, Config, Flags [none], bridge-id 8000.a0:f3:c1:b7:c3:4e.8003, length 43
19:39:45.462175 STP 802.1d, Config, Flags [none], bridge-id 8000.a0:f3:c1:b7:c3:4e.8003, length 43
19:39:45.475187 IP 10.5.0.2.54915 > 10.5.0.255.54915: UDP, length 263
19:39:45.475187 IP 10.5.0.2.54915 > 10.5.0.255.54915: UDP, length 263
19:39:45.707224 IP 10.5.0.8.53210 > 192.168.166.209.24800: Flags [S], seq 954230902, win 65535, options [mss 1460,nop,wscale 5,nop,nop,TS val 483134698 ecr 0,sackOK,eol], length 0
19:39:46.214783 IP 10.5.0.107.68 > 10.5.0.1.67: BOOTP/DHCP, Request from 00:0c:29:d3:39:8e, length 300
19:39:46.214795 IP 10.5.0.107.68 > 10.5.0.1.67: BOOTP/DHCP, Request from 00:0c:29:d3:39:8e, length 300
19:39:46.359022 IP 10.5.0.8.53073 > 74.125.71.189.443: Flags [.], ack 61, win 4094, options [nop,nop,TS val 483135349 ecr 1943813033], length 0
19:39:46.489080 IP 10.5.0.2.54915 > 10.5.0.255.54915: UDP, length 263
19:39:46.489080 IP 10.5.0.2.54915 > 10.5.0.255.54915: UDP, length 263
19:39:46.595393 IP 10.5.0.4.41309 > 10.5.0.255.32412: UDP, length 21
19:39:46.595393 IP 10.5.0.4.41309 > 10.5.0.255.32412: UDP, length 21
19:39:46.709196 IP 10.5.0.8.53210 > 192.168.166.209.24800: Flags [S], seq 954230902, win 65535, options [mss 1460,nop,wscale 5,nop,nop,TS val 483135698 ecr 0,sackOK,eol], length 0
19:39:46.800501 ARP, Request who-has 10.5.0.5 tell 10.5.0.2, length 46
19:39:46.800501 ARP, Request who-has 10.5.0.5 tell 10.5.0.2, length 46
19:39:46.800585 ARP, Request who-has 10.5.0.109 tell 10.5.0.2, length 46
19:39:46.800585 ARP, Request who-has 10.5.0.109 tell 10.5.0.2, length 46
19:39:46.817132 IP 10.5.0.8.53197 > 62.231.75.207.443: Flags [F.], seq 1322, ack 578867, win 14229, options [nop,nop,TS val 483135805 ecr 2962443852], length 0
19:39:46.817152 IP 10.5.0.8.53202 > 54.241.137.75.443: Flags [F.], seq 0, ack 1, win 4140, options [nop,nop,TS val 483135805 ecr 1949507046], length 0
19:39:46.817435 IP 10.5.0.8.55420 > 10.5.0.1.53: 51803+ A? clients6.google.com. (37)
19:39:46.826752 IP 10.5.0.8.53211 > 82.76.79.84.443: Flags [S], seq 2872447678, win 65535, options [mss 1460,nop,wscale 5,nop,nop,TS val 483135814 ecr 0,sackOK,eol], length 0
19:39:46.833917 IP 10.5.0.8.53211 > 82.76.79.84.443: Flags [.], ack 3449042062, win 4140, options [nop,nop,TS val 483135821 ecr 1067925053], length 0
19:39:46.835660 IP 10.5.0.8.53211 > 82.76.79.84.443: Flags [P.], seq 0:207, ack 1, win 4140, options [nop,nop,TS val 483135822 ecr 1067925053], length 207
19:39:46.862089 IP 10.5.0.8.53211 > 82.76.79.84.443: Flags [.], ack 2049, win 4077, options [nop,nop,TS val 483135847 ecr 1067925084], length 0
19:39:46.862108 IP 10.5.0.8.53211 > 82.76.79.84.443: Flags [.], ack 4097, win 4013, options [nop,nop,TS val 483135847 ecr 1067925084], length 0
19:39:46.862109 IP 10.5.0.8.53211 > 82.76.79.84.443: Flags [.], ack 4195, win 4092, options [nop,nop,TS val 483135847 ecr 1067925084], length 0
19:39:46.863038 IP 10.5.0.8.53211 > 82.76.79.84.443: Flags [P.], seq 207:333, ack 4195, win 4096, options [nop,nop,TS val 483135848 ecr 1067925084], length 126
19:39:46.873240 IP 10.5.0.8.53211 > 82.76.79.84.443: Flags [P.], seq 333:386, ack 4195, win 4096, options [nop,nop,TS val 483135858 ecr 1067925084], length 53
19:39:46.873271 IP 10.5.0.8.53211 > 82.76.79.84.443: Flags [P.], seq 386:436, ack 4195, win 4096, options [nop,nop,TS val 483135858 ecr 1067925084], length 50
19:39:46.873274 IP 10.5.0.8.53211 > 82.76.79.84.443: Flags [P.], seq 436:478, ack 4195, win 4096, options [nop,nop,TS val 483135858 ecr 1067925084], length 42
19:39:46.873593 IP 10.5.0.8.53211 > 82.76.79.84.443: Flags [P.], seq 478:1409, ack 4195, win 4096, options [nop,nop,TS val 483135858 ecr 1067925084], length 931
19:39:46.887851 IP 10.5.0.8.53211 > 82.76.79.84.443: Flags [.], ack 4457, win 4087, options [nop,nop,TS val 483135872 ecr 1067925111], length 0
19:39:46.887871 IP 10.5.0.8.53211 > 82.76.79.84.443: Flags [.], ack 4513, win 4086, options [nop,nop,TS val 483135872 ecr 1067925111], length 0
19:39:46.887873 IP 10.5.0.8.53211 > 82.76.79.84.443: Flags [.], ack 4555, win 4084, options [nop,nop,TS val 483135872 ecr 1067925111], length 0
19:39:46.888010 IP 10.5.0.8.53211 > 82.76.79.84.443: Flags [P.], seq 1409:1447, ack 4555, win 4096, options [nop,nop,TS val 483135872 ecr 1067925111], length 38
19:39:46.897854 IP 10.5.0.8.53211 > 82.76.79.84.443: Flags [.], ack 4593, win 4094, options [nop,nop,TS val 483135882 ecr 1067925122], length 0
19:39:46.912612 IP 10.5.0.8.53211 > 82.76.79.84.443: Flags [.], ack 5080, win 4080, options [nop,nop,TS val 483135896 ecr 1067925136], length 0
19:39:46.913855 IP 10.5.0.8.53211 > 82.76.79.84.443: Flags [P.], seq 1447:1493, ack 5080, win 4096, options [nop,nop,TS val 483135897 ecr 1067925136], length 46
19:39:46.915045 IP 10.5.0.8.52909 > 82.76.79.103.443: Flags [P.], seq 1:1265, ack 1, win 4096, options [nop,nop,TS val 483135898 ecr 2876649242], length 1264
19:39:46.915061 IP 10.5.0.8.52909 > 82.76.79.103.443: Flags [P.], seq 1265:1311, ack 1, win 4096, options [nop,nop,TS val 483135898 ecr 2876649242], length 46
19:39:46.915063 IP 10.5.0.8.52909 > 82.76.79.103.443: Flags [P.], seq 1311:1483, ack 1, win 4096, options [nop,nop,TS val 483135898 ecr 2876649242], length 172
19:39:46.941915 IP 10.5.0.8.52909 > 82.76.79.103.443: Flags [.], ack 47, win 4094, options [nop,nop,TS val 483135923 ecr 2876679026], length 0
19:39:47.038104 IP 10.5.0.8.53202 > 54.241.137.75.443: Flags [.], ack 2, win 4140, options [nop,nop,TS val 483136018 ecr 1949515333], length 0
19:39:47.039816 IP 10.5.0.8.52909 > 82.76.79.103.443: Flags [.], ack 296, win 4088, options [nop,nop,TS val 483136019 ecr 2876679123], length 0
19:39:47.041012 IP 10.5.0.8.52909 > 82.76.79.103.443: Flags [.], ack 1217, win 4067, options [nop,nop,TS val 483136020 ecr 2876679124], length 0
19:39:47.041791 IP 10.5.0.8.52909 > 82.76.79.103.443: Flags [P.], seq 1483:1529, ack 1217, win 4096, options [nop,nop,TS val 483136020 ecr 2876679124], length 46
19:39:47.363692 IP 192.168.77.1.5353 > 224.0.0.251.5353: 0 PTR (QM)? _ipp._tcp.local. (33)
19:39:47.517300 STP 802.1d, Config, Flags [none], bridge-id 8000.a0:f3:c1:b7:c3:4e.8003, length 43
19:39:47.517300 STP 802.1d, Config, Flags [none], bridge-id 8000.a0:f3:c1:b7:c3:4e.8003, length 43
19:39:47.619617 ARP, Request who-has 10.5.0.5 tell 10.5.0.2, length 46
19:39:47.619617 ARP, Request who-has 10.5.0.5 tell 10.5.0.2, length 46
19:39:47.619665 ARP, Request who-has 10.5.0.109 tell 10.5.0.2, length 46
19:39:47.619665 ARP, Request who-has 10.5.0.109 tell 10.5.0.2, length 46
19:39:47.720669 IP 10.5.0.8.53210 > 192.168.166.209.24800: Flags [S], seq 954230902, win 65535, options [mss 1460,nop,wscale 5,nop,nop,TS val 483136698 ecr 0,sackOK,eol], length 0
19:39:48.233946 IP 10.5.0.1.49735 > 255.255.255.255.7437: UDP, length 173
19:39:48.233946 IP 10.5.0.1.49735 > 255.255.255.255.7437: UDP, length 173
19:39:48.336569 IP6 fe80::383f:ff6f:7e9:f448.61940 > ff02::c.1900: UDP, length 146
19:39:48.336569 IP6 fe80::383f:ff6f:7e9:f448.61940 > ff02::c.1900: UDP, length 146
19:39:48.460527 IP 10.5.0.8.50626 > 204.154.94.82.443: Flags [P.], seq 88900081:88900121, ack 2437428452, win 65535, options [nop,nop,TS val 483137437 ecr 4233315341], length 40
19:39:48.465564 IP 10.5.0.8.60248 > 193.105.64.2.143: Flags [.], ack 543, win 4093, options [nop,nop,TS val 483137442 ecr 560639347], length 0
19:39:48.517049 IP 10.5.0.2.54915 > 10.5.0.255.54915: UDP, length 263
19:39:48.517049 IP 10.5.0.2.54915 > 10.5.0.255.54915: UDP, length 263
19:39:48.530133 IP 10.5.0.107.68 > 10.5.0.1.67: BOOTP/DHCP, Request from 00:0c:29:d3:39:8e, length 300
19:39:48.530188 IP 10.5.0.107.68 > 10.5.0.1.67: BOOTP/DHCP, Request from 00:0c:29:d3:39:8e, length 300
19:39:48.532473 ARP, Request who-has 10.5.0.5 tell 10.5.0.2, length 46
19:39:48.532473 ARP, Request who-has 10.5.0.5 tell 10.5.0.2, length 46
19:39:48.532905 ARP, Request who-has 10.5.0.109 tell 10.5.0.2, length 46
19:39:48.532905 ARP, Request who-has 10.5.0.109 tell 10.5.0.2, length 46
19:39:48.623301 IP 10.5.0.107.68 > 10.5.0.1.67: BOOTP/DHCP, Request from 00:0c:29:d3:39:8e, length 300
19:39:48.623338 IP 10.5.0.107.68 > 10.5.0.1.67: BOOTP/DHCP, Request from 00:0c:29:d3:39:8e, length 300
19:39:48.674457 IP 10.5.0.8.50626 > 204.154.94.82.443: Flags [.], ack 32, win 65535, options [nop,nop,TS val 483137650 ecr 4233609769], length 0
19:39:48.723409 IP 10.5.0.8.53210 > 192.168.166.209.24800: Flags [S], seq 954230902, win 65535, options [mss 1460,nop,wscale 5,nop,nop,TS val 483137698 ecr 0,sackOK,eol], length 0
19:39:48.771063 IP 10.5.0.8.60248 > 193.105.64.2.143: Flags [P.], seq 313:366, ack 543, win 4096, options [nop,nop,TS val 483137745 ecr 560639347], length 53
19:39:48.777698 IP 10.5.0.8.60248 > 193.105.64.2.143: Flags [.], ack 612, win 4093, options [nop,nop,TS val 483137751 ecr 560639660], length 0
19:39:48.778502 IP 10.5.0.8.60248 > 193.105.64.2.143: Flags [P.], seq 366:419, ack 612, win 4096, options [nop,nop,TS val 483137751 ecr 560639660], length 53
19:39:48.784053 IP 10.5.0.8.60248 > 193.105.64.2.143: Flags [.], ack 681, win 4093, options [nop,nop,TS val 483137756 ecr 560639666], length 0
19:39:48.784825 IP 10.5.0.8.60248 > 193.105.64.2.143: Flags [P.], seq 419:488, ack 681, win 4096, options [nop,nop,TS val 483137756 ecr 560639666], length 69
19:39:48.790473 IP 10.5.0.8.60248 > 193.105.64.2.143: Flags [.], ack 846, win 4090, options [nop,nop,TS val 483137762 ecr 560639673], length 0
19:39:48.791387 IP 10.5.0.8.60248 > 193.105.64.2.143: Flags [P.], seq 488:573, ack 846, win 4096, options [nop,nop,TS val 483137762 ecr 560639673], length 85
19:39:48.798533 IP 10.5.0.8.60248 > 193.105.64.2.143: Flags [.], ack 963, win 4092, options [nop,nop,TS val 483137770 ecr 560639681], length 0
19:39:48.890129 IP 10.5.0.8.50626 > 204.154.94.82.443: Flags [.], ack 66, win 65535, options [nop,nop,TS val 483137861 ecr 4233609978], length 0
19:39:49.000676 IP 10.5.0.8.60248 > 193.105.64.2.143: Flags [P.], seq 573:626, ack 963, win 4096, options [nop,nop,TS val 483137971 ecr 560639681], length 53
19:39:49.006851 IP 10.5.0.8.60248 > 193.105.64.2.143: Flags [.], ack 1016, win 4094, options [nop,nop,TS val 483137977 ecr 560639889], length 0
19:39:49.179736 IP 10.5.0.107.68 > 10.5.0.1.67: BOOTP/DHCP, Request from 00:0c:29:d3:39:8e, length 300
19:39:49.179752 IP 10.5.0.107.68 > 10.5.0.1.67: BOOTP/DHCP, Request from 00:0c:29:d3:39:8e, length 300
19:39:49.565340 STP 802.1d, Config, Flags [none], bridge-id 8000.a0:f3:c1:b7:c3:4e.8003, length 43
19:39:49.565340 STP 802.1d, Config, Flags [none], bridge-id 8000.a0:f3:c1:b7:c3:4e.8003, length 43
19:39:49.565599 IP 10.5.0.2.54915 > 10.5.0.255.54915: UDP, length 263
19:39:49.565599 IP 10.5.0.2.54915 > 10.5.0.255.54915: UDP, length 263
19:39:49.728282 IP 10.5.0.8.53210 > 192.168.166.209.24800: Flags [S], seq 954230902, win 65535, options [mss 1460,nop,wscale 5,nop,nop,TS val 483138698 ecr 0,sackOK,eol], length 0
19:39:49.770053 ARP, Request who-has 10.5.0.5 tell 10.5.0.2, length 46
19:39:49.770053 ARP, Request who-has 10.5.0.5 tell 10.5.0.2, length 46
19:39:49.770123 ARP, Request who-has 10.5.0.109 tell 10.5.0.2, length 46
19:39:49.770123 ARP, Request who-has 10.5.0.109 tell 10.5.0.2, length 46
19:39:49.952334 IP 10.5.0.107.68 > 10.5.0.1.67: BOOTP/DHCP, Request from 00:0c:29:d3:39:8e, length 300
19:39:49.952401 IP 10.5.0.107.68 > 10.5.0.1.67: BOOTP/DHCP, Request from 00:0c:29:d3:39:8e, length 300
19:39:50.589158 ARP, Request who-has 10.5.0.5 tell 10.5.0.2, length 46
19:39:50.589158 ARP, Request who-has 10.5.0.5 tell 10.5.0.2, length 46
19:39:50.729295 IP 10.5.0.8.53210 > 192.168.166.209.24800: Flags [S], seq 954230902, win 65535, options [mss 1460,nop,wscale 5,nop,nop,TS val 483139699 ecr 0,sackOK,eol], length 0
19:39:50.783554 IP 10.5.0.107.68 > 10.5.0.1.67: BOOTP/DHCP, Request from 00:0c:29:d3:39:8e, length 300
19:39:50.783634 IP 10.5.0.107.68 > 10.5.0.1.67: BOOTP/DHCP, Request from 00:0c:29:d3:39:8e, length 300
19:39:50.983915 IP 192.168.77.1.5353 > 224.0.0.251.5353: 0 PTR (QM)? _ipp._tcp.local. (33)
19:39:51.306153 IP 10.5.0.1.49735 > 255.255.255.255.7437: UDP, length 173
19:39:51.306153 IP 10.5.0.1.49735 > 255.255.255.255.7437: UDP, length 173
19:39:51.408576 IP6 fe80::383f:ff6f:7e9:f448.61940 > ff02::c.1900: UDP, length 146
19:39:51.408576 IP6 fe80::383f:ff6f:7e9:f448.61940 > ff02::c.1900: UDP, length 146
19:39:51.510977 STP 802.1d, Config, Flags [none], bridge-id 8000.a0:f3:c1:b7:c3:4e.8003, length 43
19:39:51.510977 STP 802.1d, Config, Flags [none], bridge-id 8000.a0:f3:c1:b7:c3:4e.8003, length 43
19:39:51.613357 IP 10.5.0.2.17500 > 255.255.255.255.17500: UDP, length 176
19:39:51.613357 IP 10.5.0.2.17500 > 255.255.255.255.17500: UDP, length 176
19:39:51.613675 IP 10.5.0.2.17500 > 10.5.0.255.17500: UDP, length 176
19:39:51.613675 IP 10.5.0.2.17500 > 10.5.0.255.17500: UDP, length 176
19:39:51.614171 IP 10.5.0.2.17500 > 255.255.255.255.17500: UDP, length 176
19:39:51.614171 IP 10.5.0.2.17500 > 255.255.255.255.17500: UDP, length 176
19:39:51.614537 IP 10.5.0.2.17500 > 255.255.255.255.17500: UDP, length 176
19:39:51.614537 IP 10.5.0.2.17500 > 255.255.255.255.17500: UDP, length 176
19:39:51.614550 ARP, Request who-has 10.5.0.5 tell 10.5.0.2, length 46
19:39:51.614550 ARP, Request who-has 10.5.0.5 tell 10.5.0.2, length 46
19:39:51.614936 ARP, Request who-has 10.5.0.109 tell 10.5.0.2, length 46
19:39:51.614936 ARP, Request who-has 10.5.0.109 tell 10.5.0.2, length 46
19:39:51.615673 IP 10.5.0.2.54915 > 10.5.0.255.54915: UDP, length 263
19:39:51.615673 IP 10.5.0.2.54915 > 10.5.0.255.54915: UDP, length 263
19:39:51.615702 IP 10.5.0.4.41309 > 10.5.0.255.32412: UDP, length 21
19:39:51.615702 IP 10.5.0.4.41309 > 10.5.0.255.32412: UDP, length 21
19:39:51.615987 IP 10.5.0.4.40868 > 10.5.0.255.32414: UDP, length 21
19:39:51.615987 IP 10.5.0.4.40868 > 10.5.0.255.32414: UDP, length 21
19:39:52.637472 IP 10.5.0.2.54915 > 10.5.0.255.54915: UDP, length 263
19:39:52.637472 IP 10.5.0.2.54915 > 10.5.0.255.54915: UDP, length 263
19:39:52.730746 IP 10.5.0.8.53210 > 192.168.166.209.24800: Flags [S], seq 954230902, win 65535, options [mss 1460,nop,wscale 5,nop,nop,TS val 483141700 ecr 0,sackOK,eol], length 0
19:39:52.733038 IP 10.5.0.8.52678 > 108.160.170.50.443: Flags [.], ack 326, win 4085, options [nop,nop,TS val 483141702 ecr 2257500518], length 0
19:39:52.734742 IP 10.5.0.8.52678 > 108.160.170.50.443: Flags [P.], seq 458:916, ack 326, win 4096, options [nop,nop,TS val 483141703 ecr 2257500518], length 458
19:39:52.739635 ARP, Request who-has 10.5.0.109 tell 10.5.0.2, length 46
19:39:52.739635 ARP, Request who-has 10.5.0.109 tell 10.5.0.2, length 46
19:39:52.739682 ARP, Request who-has 10.5.0.5 tell 10.5.0.2, length 46
19:39:52.739682 ARP, Request who-has 10.5.0.5 tell 10.5.0.2, length 46

